id	audio	n_frames	tgt_text	src_text
test_ted_1096_0	/mnt/zhangyh/DATA/mustc-enes/test-split/test_ted_1096_0.wav	405	En Nueva York soy responsable de desarrollo de una organización sin fines de lucro llamada Robin Hood.	back in new york, i am the head of development for a non-profit called robin hood.
test_ted_1096_1	/mnt/zhangyh/DATA/mustc-enes/test-split/test_ted_1096_1.wav	512	Cuando no estoy combatiendo la pobreza, combato incendios como asistente de capitán en un cuerpo de bomberos voluntarios.	when i'm not fighting poverty, i'm fighting fires as the assistant captain of a volunteer fire company.
test_ted_1096_2	/mnt/zhangyh/DATA/mustc-enes/test-split/test_ted_1096_2.wav	808	Y, en nuestra ciudad, donde los voluntarios complementan a un personal altamente calificado uno tiene que llegar al sitio del incendio muy pronto para entrar en acción.	now in our town, where the volunteers supplement a highly skilled career staff, you have to get to the fire scene pretty early to get in on any action.
test_ted_1096_3	/mnt/zhangyh/DATA/mustc-enes/test-split/test_ted_1096_3.wav	595	Recuerdo mi primer incendio. Yo era el segundo voluntario en el sitio, así que tenía una probabilidad bastante alta de ir.	i remember my first fire. i was the second volunteer on the scene, so there was a pretty good chance i was going to get in.
test_ted_1096_4	/mnt/zhangyh/DATA/mustc-enes/test-split/test_ted_1096_4.wav	555	Pero aún así hubo una carrera a pie contra los otros voluntarios para llegar al capitán a cargo y averiguar cuál era nuestra tarea.	but still it was a real footrace against the other volunteers to get to the captain in charge to find out what our assignments would be.
test_ted_1096_5	/mnt/zhangyh/DATA/mustc-enes/test-split/test_ted_1096_5.wav	858	Cuando encontré al capitán, estaba enfrascado en una conversación con la propietaria que sin duda atravesaba uno de los peores días de su vida.	when i found the captain, he was having a very engaging conversation with the homeowner, who was surely having one of the worst days of her life.
test_ted_1096_6	/mnt/zhangyh/DATA/mustc-enes/test-split/test_ted_1096_6.wav	957	Estábamos en plena noche, ella estaba de pie afuera en la lluvia, bajo un paraguas, en pijama, descalza, mientras su casa estaba en llamas.	here it was, the middle of the night, she was standing outside in the pouring rain, under an umbrella, in her pajamas, barefoot, while her house was in flames.
test_ted_1096_7	/mnt/zhangyh/DATA/mustc-enes/test-split/test_ted_1096_7.wav	1832	El otro voluntario que acababa de llegar antes que yo, -llamémosle Lex Luther- (Risas) llegó primero hasta el capitán y éste le pidió que entrara y salvara al perro de la dueña de casa. ¡El perro! ¡Yo estaba 'tan celoso'!	the other volunteer who had arrived just before me — let's call him lex luther — (laughter) got to the captain first and was asked to go inside and save the homeowner's dog. the dog! i was stunned with jealousy.
test_ted_1096_8	/mnt/zhangyh/DATA/mustc-enes/test-split/test_ted_1096_8.wav	1035	Ahí estaba un abogado o gestor de dinero que, durante el resto de su vida, tendría que decirle a la gente que entró en un edificio en llamas para salvar a un ser vivo sólo porque me ganó por 5 segundos.	here was some lawyer or money manager who, for the rest of his life, gets to tell people that he went into a burning building to save a living creature, just because he beat me by five seconds.
test_ted_1096_9	/mnt/zhangyh/DATA/mustc-enes/test-split/test_ted_1096_9.wav	202	Bueno, yo era el siguiente.	well, i was next.
test_ted_1096_10	/mnt/zhangyh/DATA/mustc-enes/test-split/test_ted_1096_10.wav	138	El capitán me hizo un ademán.	the captain waved me over.
test_ted_1096_11	/mnt/zhangyh/DATA/mustc-enes/test-split/test_ted_1096_11.wav	255	Dijo: "Bezos, necesito que entre a la casa.	he said, "bezos, i need you to go into the house.
test_ted_1096_12	/mnt/zhangyh/DATA/mustc-enes/test-split/test_ted_1096_12.wav	932	Necesito que suba, atraviese el fuego, y le traiga a esta mujer un par de zapatos ". (Risas) Lo juro.	i need you to go upstairs, past the fire, and i need you to get this woman a pair of shoes. "(laughter) i swear.
test_ted_1096_13	/mnt/zhangyh/DATA/mustc-enes/test-split/test_ted_1096_13.wav	1398	No era exactamente lo que esperaba pero fui... subí las escaleras, al final del pasillo, pasé a los bomberos' reales' que a esa altura más o menos habían terminado de apagar el fuego y entré al cuarto principal en busca de un par de zapatos.	so, not exactly what i was hoping for, but off i went — up the stairs, down the hall, past the 'real' firefighters, who were pretty much done putting out the fire at this point, into the master bedroom to get a pair of shoes.
test_ted_1096_14	/mnt/zhangyh/DATA/mustc-enes/test-split/test_ted_1096_14.wav	1639	Sé lo que están pensando, pero no soy un héroe. (Risas) Llevé mi carga de vuelta por la escalera donde conocí a mi Némesis y al precioso perro en la puerta principal.	now i know what you're thinking, but i'm no hero. (laughter) i carried my payload back downstairs where i met my nemesis and the precious dog by the front door.
test_ted_1096_15	/mnt/zhangyh/DATA/mustc-enes/test-split/test_ted_1096_15.wav	739	Sacamos de la casa los tesoros para la dueña de casa donde, como era de esperar, su tesoro recibió mucha más atención que el mío.	we took our treasures outside to the homeowner, where, not surprisingly, his received much more attention than did mine.
test_ted_1096_16	/mnt/zhangyh/DATA/mustc-enes/test-split/test_ted_1096_16.wav	601	Unas semanas más tarde el departamento recibió una carta de la dueña de casa agradeciéndonos por el valiente esfuerzo demostrado para salvar su casa.	a few weeks later, the department received a letter from the homeowner thanking us for the valiant effort displayed in saving her home.
test_ted_1096_17	/mnt/zhangyh/DATA/mustc-enes/test-split/test_ted_1096_17.wav	590	La amabilidad que ella observó por sobre lo demás fue que alguien le había alcanzado incluso un par de zapatos.	the act of kindness she noted above all others: someone had even gotten her a pair of shoes.
test_ted_1096_19	/mnt/zhangyh/DATA/mustc-enes/test-split/test_ted_1096_19.wav	1328	Tanto en mi vocación en Robin Hood como en mi vocación como bombero voluntario soy testigo de actos de generosidad y amabilidad en una escala monumental, pero también de actos de gracia y coraje a nivel individual. ¿Y saben qué he aprendido?	in both my vocation at robin hood and my avocation as a volunteer firefighter, i am witness to acts of generosity and kindness on a monumental scale, but i'm also witness to acts of grace and courage on an individual basis.
test_ted_1096_20	/mnt/zhangyh/DATA/mustc-enes/test-split/test_ted_1096_20.wav	1418	Todo tiene su importancia. Entonces, cuando miro en esta sala a personas que han logrado, o están por lograr, niveles notables de éxito me gustaría recordarles esto: no esperen.	and you know what i've learned? they all matter. so as i look around this room at people who either have achieved, or are on their way to achieving, remarkable levels of success, i would offer this reminder: don't wait.
test_ted_1096_21	/mnt/zhangyh/DATA/mustc-enes/test-split/test_ted_1096_21.wav	302	No esperen a ganar el primer millón para marcar la diferencia en la vida de alguien.	don't wait until you make your first million to make a difference in somebody's life.
test_ted_1096_22	/mnt/zhangyh/DATA/mustc-enes/test-split/test_ted_1096_22.wav	278	Si tienen algo para dar, denlo ahora.	if you have something to give, give it now.
test_ted_1096_23	/mnt/zhangyh/DATA/mustc-enes/test-split/test_ted_1096_23.wav	428	Sirvan comida en un comedor, limpien un parque del vecindario, sean mentores.	serve food at a soup kitchen. clean up a neighborhood park. be a mentor.
test_ted_1096_24	/mnt/zhangyh/DATA/mustc-enes/test-split/test_ted_1096_24.wav	702	No todos los días vamos a tener la oportunidad de salvar la vida de alguien pero cada día vamos a poder influir la vida de alguien.	not every day is going to offer us a chance to save somebody's life, but every day offers us an opportunity to affect one.
test_ted_1096_25	/mnt/zhangyh/DATA/mustc-enes/test-split/test_ted_1096_25.wav	239	Así que entren al juego; salven los zapatos.	so get in the game. save the shoes.
test_ted_1096_26	/mnt/zhangyh/DATA/mustc-enes/test-split/test_ted_1096_26.wav	870	Gracias.	thank you.
test_ted_1096_28	/mnt/zhangyh/DATA/mustc-enes/test-split/test_ted_1096_28.wav	535	Bruno Giussani: Mark, Mark, regresa.	bruno giussani: mark, mark, come back.
test_ted_1102_0	/mnt/zhangyh/DATA/mustc-enes/test-split/test_ted_1102_0.wav	410	Acabo de regresar de una comunidad que tiene el secreto de la supervivencia humana.	i just came back from a community that holds the secret to human survival.
test_ted_1102_1	/mnt/zhangyh/DATA/mustc-enes/test-split/test_ted_1102_1.wav	941	Es un lugar donde las mujeres tienen la batuta, practican sexo para decir hola, y el juego es la orden del día... donde la diversión es algo serio.	it's a place where women run the show, have sex to say hello, and play rules the day — where fun is serious business.
test_ted_1102_2	/mnt/zhangyh/DATA/mustc-enes/test-split/test_ted_1102_2.wav	841	Y no, no es el festival del Hombre Ardiente o San Francisco. (Risas) Damas y caballeros, conozcan a sus primos.	and no, this isn't burning man or san francisco. (laughter) ladies and gentlemen, meet your cousins.
test_ted_1102_3	/mnt/zhangyh/DATA/mustc-enes/test-split/test_ted_1102_3.wav	367	Este es el mundo de los bonobos salvajes de las selvas de Congo.	this is the world of wild bonobos in the jungles of congo.
test_ted_1102_4	/mnt/zhangyh/DATA/mustc-enes/test-split/test_ted_1102_4.wav	581	Los bonobos son, junto con los chimpancés, sus parientes vivos más cercanos.	bonobos are, together with chimpanzees, your living closest relative.
test_ted_1102_5	/mnt/zhangyh/DATA/mustc-enes/test-split/test_ted_1102_5.wav	696	Eso significa que todos compartimos un ancestro común, una abuela evolutiva, que vivió hace unos 6 millones de años.	that means we all share a common ancestor, an evolutionary grandmother, who lived around six million years ago.
test_ted_1102_6	/mnt/zhangyh/DATA/mustc-enes/test-split/test_ted_1102_6.wav	397	Ahora bien, los chimpancés son conocidos por su agresión.	now, chimpanzees are well-known for their aggression.
test_ted_1102_8	/mnt/zhangyh/DATA/mustc-enes/test-split/test_ted_1102_8.wav	674	Pero, por desgracia, hemos hecho demasiado hincapié en este aspecto en nuestras narrativas de la evolución humana.	but unfortunately, we have made too much of an emphasis of this aspect in our narratives of human evolution.
test_ted_1102_9	/mnt/zhangyh/DATA/mustc-enes/test-split/test_ted_1102_9.wav	318	Pero los bonobos nos muestran el otro lado de la moneda.	but bonobos show us the other side of the coin.
test_ted_1102_10	/mnt/zhangyh/DATA/mustc-enes/test-split/test_ted_1102_10.wav	871	Mientras que los chimpancés son dominados por tipos grandes, aterradores, la sociedad bonobo está a cargo de hembras con poder.	while chimpanzees are dominated by big, scary guys, bonobo society is run by empowered females.
test_ted_1102_11	/mnt/zhangyh/DATA/mustc-enes/test-split/test_ted_1102_11.wav	984	Estos muchachos han creado algo especial, ya que esto conduce a una sociedad muy tolerante donde la violencia mortal todavía no se ha observado.	these guys have really worked something out, since this leads to a highly tolerant society where fatal violence has not been observed yet.
test_ted_1102_12	/mnt/zhangyh/DATA/mustc-enes/test-split/test_ted_1102_12.wav	436	Pero, por desgracia, los bonobos son los menos comprendidos de los grandes simios.	but unfortunately, bonobos are the least understood of the great apes.
test_ted_1102_13	/mnt/zhangyh/DATA/mustc-enes/test-split/test_ted_1102_13.wav	608	Viven en las profundidades de la selva congoleña, y ha sido muy difícil estudiarlos.	they live in the depths of the congolese jungle, and it has been very difficult to study them.
test_ted_1102_14	/mnt/zhangyh/DATA/mustc-enes/test-split/test_ted_1102_14.wav	1980	El Congo es una paradoja... una tierra de extraordinaria biodiversidad y belleza, pero también el corazón de la tiniebla misma... escenario de un conflicto violento que se ha prolongado por décadas y causado casi tantas muertes como la Primera Guerra Mundial.	the congo is a paradox — a land of extraordinary biodiversity and beauty, but also the heart of darkness itself — the scene of a violent conflict that has raged for decades and claimed nearly as many lives as the first world war.
test_ted_1102_15	/mnt/zhangyh/DATA/mustc-enes/test-split/test_ted_1102_15.wav	534	No es de extrañar que esta destrucción también ponga en peligro la supervivencia del bonobo.	not surprisingly, this destruction also endangers bonobo survival.
test_ted_1102_16	/mnt/zhangyh/DATA/mustc-enes/test-split/test_ted_1102_16.wav	1032	El comercio de carne de caza y la deforestación hacen que no se pueda llenar ni un estadio con los bonobos que quedan en el mundo... y, honestamente, no estamos ni seguros de ello.	bushmeat trades and forest loss means we couldn't fill a small stadium with all the bonobos that are left in the world — and we're not even sure of that to be honest.
test_ted_1102_17	/mnt/zhangyh/DATA/mustc-enes/test-split/test_ted_1102_17.wav	812	Sin embargo, en esta tierra de violencia y caos se puede oír la risa escondida meciendo los árboles.	yet, in this land of violence and chaos, you can hear hidden laughter swaying the trees.
test_ted_1102_18	/mnt/zhangyh/DATA/mustc-enes/test-split/test_ted_1102_18.wav	1440	¿Quiénes son estos primos? Los conocemos como los simios "haz el amor, no la guerra", ya que tienen sexo frecuente, promiscuo y bisexual para manejar conflictos y resolver problemas sociales.	who are these cousins? we know them as the "make love, not war" apes since they have frequent, promiscuous and bisexual sex to manage conflict and solve social issues.
test_ted_1102_19	/mnt/zhangyh/DATA/mustc-enes/test-split/test_ted_1102_19.wav	932	No estoy diciendo que ésta es la solución a todos los problemas de la Humanidad dado que la vida de los bonobo es más que el Kama Sutra.	now, i'm not saying this is the solution to all of humanity's problems — since there's more to bonobo life than the kama sutra.
test_ted_1102_20	/mnt/zhangyh/DATA/mustc-enes/test-split/test_ted_1102_20.wav	348	A los bonobos, como a los humanos, les encanta jugar a lo largo de toda su vida.	bonobos, like humans, love to play throughout their entire lives.
test_ted_1102_21	/mnt/zhangyh/DATA/mustc-enes/test-split/test_ted_1102_21.wav	194	Jugar no es sólo un juego de niños.	play is not just child's games.
test_ted_1102_22	/mnt/zhangyh/DATA/mustc-enes/test-split/test_ted_1102_22.wav	546	Para nosotros y para ellos el juego es fundamental para establecer vínculos y fomentar la tolerancia.	for us and them, play is foundational for bonding relationships and fostering tolerance.
test_ted_1102_23	/mnt/zhangyh/DATA/mustc-enes/test-split/test_ted_1102_23.wav	389	Con él aprendemos a confiar, y aprendemos las reglas del juego.	it's where we learn to trust and where we learn about the rules of the game.
test_ted_1102_24	/mnt/zhangyh/DATA/mustc-enes/test-split/test_ted_1102_24.wav	1346	El juego aumenta la creatividad y la resiliencia y tiene que ver con la generación de diversidad... diversidad de interacciones, diversidad de comportamientos, diversidad de conexiones.	play increases creativity and resilience, and it's all about the generation of diversity — diversity of interactions, diversity of behaviors, diversity of connections.
test_ted_1102_25	/mnt/zhangyh/DATA/mustc-enes/test-split/test_ted_1102_25.wav	777	Y cuando uno observa el juego bonobo ve las raíces evolutivas mismas de la risa, la danza y el ritual humanos.	and when you watch bonobo play, you're seeing the very evolutionary roots of human laughter, dance and ritual.
test_ted_1102_26	/mnt/zhangyh/DATA/mustc-enes/test-split/test_ted_1102_26.wav	273	El juego es el pegamento que nos une.	play is the glue that binds us together.
test_ted_1102_27	/mnt/zhangyh/DATA/mustc-enes/test-split/test_ted_1102_27.wav	663	No sé cómo juegan ustedes pero quiero mostrarles un par de videos únicos recién tomados del medio silvestre.	now, i don't know how you play, but i want to show you a couple of unique clips fresh from the wild.
test_ted_1102_28	/mnt/zhangyh/DATA/mustc-enes/test-split/test_ted_1102_28.wav	498	Primero, es un juego de pelota estilo bonobo; y no hablo de fútbol.	first, it's a ball game bonobo-style — and i do not mean football.
test_ted_1102_29	/mnt/zhangyh/DATA/mustc-enes/test-split/test_ted_1102_29.wav	564	Aquí tenemos a una hembra y un macho jóvenes en medio de una persecución.	so here, we have a young female and a male engaged in a chase game.
test_ted_1102_30	/mnt/zhangyh/DATA/mustc-enes/test-split/test_ted_1102_30.wav	134	Miren lo que está haciendo ella.	have a look what she's doing.
test_ted_1102_31	/mnt/zhangyh/DATA/mustc-enes/test-split/test_ted_1102_31.wav	992	Podría ser el origen evolutivo de la frase: "lo tiene agarrado de las pelotas". (Risas) Sólo que creo que en este caso a él le encanta, ¿no?	it might be the evolutionary origin of the phrase, "she's got him by the balls." (laughter) only i think that he's rather loving it here, right?
test_ted_1102_32	/mnt/zhangyh/DATA/mustc-enes/test-split/test_ted_1102_32.wav	667	Sí. (Risas) Así que el juego sexual es común tanto en bonobos como en humanos.	yeah. (laughter) so sex play is common in both bonobos and humans.
test_ted_1102_33	/mnt/zhangyh/DATA/mustc-enes/test-split/test_ted_1102_33.wav	2126	Y este video realmente es interesante porque muestra... este video realmente es interesante porque muestra la inventiva de traer elementos inusuales al juego -como los testículos- y también cómo el juego requiere confianza y fomenta la confianza... y al mismo tiempo es de lo más divertido.	and this video is really interesting because it shows — this video's really interesting because it shows the inventiveness of bringing unusual elements into play — such as testicles — and also how play both requires trust and fosters trust — while at the same time being tremendous fun.
test_ted_1102_34	/mnt/zhangyh/DATA/mustc-enes/test-split/test_ted_1102_34.wav	1549	Pero el juego es polimórfico. (Risas) El juego es polimórfico, puede adoptar muchas formas, algunas de las cuales son más tranquilas, imaginativas, curiosas... quizá el lugar donde se redescubre el asombro.	but play's a shapeshifter. (laughter) play's a shapeshifter, and it can take many forms, some of which are more quiet, imaginative, curious — maybe where wonder is discovered anew.
test_ted_1102_35	/mnt/zhangyh/DATA/mustc-enes/test-split/test_ted_1102_35.wav	507	Y quiero que vean... esta es Fuku, una hembra joven, que está jugando con agua tranquilamente.	and i want you to see, this is fuku, a young female, and she is quietly playing with water.
test_ted_1102_36	/mnt/zhangyh/DATA/mustc-enes/test-split/test_ted_1102_36.wav	675	Creo que, como ella, a veces jugamos solos, y exploramos los límites de nuestros mundos interior y exterior.	i think, like her, we sometimes play alone, and we explore the boundaries of our inner and our outer worlds.
test_ted_1102_37	/mnt/zhangyh/DATA/mustc-enes/test-split/test_ted_1102_37.wav	1135	Y es esa curiosidad lúdica la que nos impulsa a explorar, a interactuar. Y luego las conexiones inesperadas que formamos son el semillero real de la creatividad.	and it's that playful curiosity that drives us to explore, drives us to interact, and then the unexpected connections we form are the real hotbed for creativity.
test_ted_1102_38	/mnt/zhangyh/DATA/mustc-enes/test-split/test_ted_1102_38.wav	683	Estas son sólo pequeñas muestras de la comprensión que los bonobo nos dan de nuestro pasado y presente.	so these are just small tasters into the insights that bonobo give us to our past and present.
test_ted_1102_39	/mnt/zhangyh/DATA/mustc-enes/test-split/test_ted_1102_39.wav	1117	Pero también tienen un secreto para nuestro futuro, un futuro en el que tenemos que adaptarnos a un mundo cada vez más difícil con mayor creatividad y mayor cooperación.	but they also hold a secret for our future, a future where we need to adapt to an increasingly challenging world through greater creativity and greater cooperation.
test_ted_1102_40	/mnt/zhangyh/DATA/mustc-enes/test-split/test_ted_1102_40.wav	468	El secreto es que el juego es la clave de estas capacidades.	the secret is that play is the key to these capacities.
test_ted_1102_41	/mnt/zhangyh/DATA/mustc-enes/test-split/test_ted_1102_41.wav	325	En otras palabras, el juego es nuestro comodín de adaptación.	in other words, play is our adaptive wildcard.
test_ted_1102_42	/mnt/zhangyh/DATA/mustc-enes/test-split/test_ted_1102_42.wav	484	Para adaptarnos con éxito a un mundo que cambia tenemos que jugar.	in order to adapt successfully to a changing world, we need to play.
test_ted_1102_43	/mnt/zhangyh/DATA/mustc-enes/test-split/test_ted_1102_43.wav	319	Pero, ¿aprovecharemos al máximo nuestra capacidad de juego?	but will we make the most of our playfulness?
test_ted_1102_44	/mnt/zhangyh/DATA/mustc-enes/test-split/test_ted_1102_44.wav	848	El juego no es frívolo; el juego es esencial. Para bonobos y humanos por igual, la vida no es sólo cruel y despiadada.	play is not frivolous. play's essential. for bonobos and humans alike, life is not just red in tooth and claw.
test_ted_1102_45	/mnt/zhangyh/DATA/mustc-enes/test-split/test_ted_1102_45.wav	575	Cuando parece lo menos apropiado jugar, pueden ser los momentos en que sea lo más urgente.	in times when it seems least appropriate to play, it might be the times when it is most urgent.
test_ted_1102_46	/mnt/zhangyh/DATA/mustc-enes/test-split/test_ted_1102_46.wav	1344	Por eso, compañeros primates, aceptemos este regalo de la evolución y juguemos juntos mientras redescubrimos la creatividad, la amistad y el asombro.	and so, my fellow primates, let us embrace this gift from evolution and play together, as we rediscover creativity, fellowship and wonder.
test_ted_1102_47	/mnt/zhangyh/DATA/mustc-enes/test-split/test_ted_1102_47.wav	45	Gracias.	thank you.
test_ted_1104_0	/mnt/zhangyh/DATA/mustc-enes/test-split/test_ted_1104_0.wav	1597	Quiero que se imaginen un robot que se pueda llevar y que dé habilidades sobrehumanas. u otro que haga que usuarios de sillas de ruedas se levanten y vuelvan a caminar.	i want you now to imagine a wearable robot that gives you superhuman abilities, or another one that takes wheelchair users up standing and walking again.
test_ted_1104_1	/mnt/zhangyh/DATA/mustc-enes/test-split/test_ted_1104_1.wav	430	En "Berkely Bionics" llamamos a estos robots, exoesqueletos.	we at berkeley bionics call these robots exoskeletons.
test_ted_1104_2	/mnt/zhangyh/DATA/mustc-enes/test-split/test_ted_1104_2.wav	1730	No son nada distinto de algo que se pone en la mañana, le da a uno una gran fuerza, que además le incrementa su velocidad, y le ayuda, por ejemplo, a manejar el equilibrio.	these are nothing else than something that you put on in the morning, and it will give you extra strength, and it will further enhance your speed, and it will help you, for instance, to manage your balance.
test_ted_1104_3	/mnt/zhangyh/DATA/mustc-enes/test-split/test_ted_1104_3.wav	535	En realidad es la integración verdadera del hombre y la máquina.	it is actually the true integration of the man and the machine.
test_ted_1104_4	/mnt/zhangyh/DATA/mustc-enes/test-split/test_ted_1104_4.wav	712	Pero no solo eso - lo puede integrar y conectarlo con el universo y con otros entes exteriores.	but not only that — it will integrate and network you to the universe and other devices out there.
test_ted_1104_5	/mnt/zhangyh/DATA/mustc-enes/test-split/test_ted_1104_5.wav	209	Esto no es una idea irreal.	this is just not some blue sky thinking.
test_ted_1104_6	/mnt/zhangyh/DATA/mustc-enes/test-split/test_ted_1104_6.wav	1377	Para mostrarles ahora en lo que estamos trabajando comenzamos por hablar del soldado estadounidense que, en promedio, debe llevar sobre su espalda una carga de 45 kilos, y se le está exigiendo llevar aún más equipo.	to show you now what we are working on by starting out talking about the american soldier, that on average does carry about 100 lbs. on their backs, and they are being asked to carry more equipment.
test_ted_1104_7	/mnt/zhangyh/DATA/mustc-enes/test-split/test_ted_1104_7.wav	1018	Obviamente, esto conduce a algunas complicaciones importantes - lesiones en la espalda, en el 30% de los soldados - con daños crónicos de espalda.	obviously, this is resulting in some major complications — back injuries, 30 percent of them — chronic back injuries.
test_ted_1104_8	/mnt/zhangyh/DATA/mustc-enes/test-split/test_ted_1104_8.wav	886	Decidimos contemplar este desafío y crear un exoesqueleto que pudiese ayudar a manejar el asunto.	so we thought we would look at this challenge and create an exoskeleton that would help deal with this issue.
test_ted_1104_9	/mnt/zhangyh/DATA/mustc-enes/test-split/test_ted_1104_9.wav	758	Permítanme presentarles el HULC - o Porta Cargas Humano Universal	so let me now introduce to you hulc — or the human universal load carrier.
test_ted_1104_10	/mnt/zhangyh/DATA/mustc-enes/test-split/test_ted_1104_10.wav	467	Soldado: Con el exoesqueleto HULC puedo portar 90 kilos por terrenos variables durante muchas horas.	soldier: with the hulc exoskeleton, i can carry 200 lbs. over varied terrain for many hours.
