id	audio	n_frames	tgt_text	src_text
test_ted_1368_10	/mnt/zhangyh/DATA/mustc-enes/test-split/test_ted_1368_10.wav	200	Murió quebrado por la historia.	he died broken by history.
test_ted_1368_11	/mnt/zhangyh/DATA/mustc-enes/test-split/test_ted_1368_11.wav	874	Él es mi abuelo. Nunca lo conocí. Pero nuestras vidas son mucho más que nuestros recuerdos.	he is my grandfather. i never knew him in real life. but our lives are much more than our memories.
test_ted_1368_12	/mnt/zhangyh/DATA/mustc-enes/test-split/test_ted_1368_12.wav	241	My abuela nunca me permitió olvidar su historia.	my grandmother never let me forget his life.
test_ted_1368_13	/mnt/zhangyh/DATA/mustc-enes/test-split/test_ted_1368_13.wav	847	My tarea era no dejar que eso haya sido en vano, y mi lección era aprender que la historia trató de aplastarnos, pero lo soportamos.	my duty was not to allow it to have been in vain, and my lesson was to learn that, yes, history tried to crush us, but we endured.
test_ted_1368_14	/mnt/zhangyh/DATA/mustc-enes/test-split/test_ted_1368_14.wav	540	La siguiente parte del rompecabezas es sobre un bote al amanecer delizándose silenciosamente hacia el mar.	the next piece of the jigsaw is of a boat in the early dawn slipping silently out to sea.
test_ted_1368_15	/mnt/zhangyh/DATA/mustc-enes/test-split/test_ted_1368_15.wav	754	My madre, Mai, tenía tan sólo 18 años cuando su padre murió, y un matrimonio concertado y dos niñas pequeñas.	my mother, mai, was 18 when her father died — already in an arranged marriage, already with two small girls.
test_ted_1368_16	/mnt/zhangyh/DATA/mustc-enes/test-split/test_ted_1368_16.wav	663	Para ella, la vida se había destinado a una tarea sola: el escape de su familia y una vida nueva en Australia.	for her, life had distilled itself into one task: the escape of her family and a new life in australia.
test_ted_1368_17	/mnt/zhangyh/DATA/mustc-enes/test-split/test_ted_1368_17.wav	266	Era inconcebible para ella que no pudiera lograrlo.	it was inconceivable to her that she would not succeed.
test_ted_1368_18	/mnt/zhangyh/DATA/mustc-enes/test-split/test_ted_1368_18.wav	602	Y luego de una saga de 4 años que desafía la ficción, un bote se deslizó hacia el mar disfrazado de buque pesquero.	so after a four-year saga that defies fiction, a boat slipped out to sea disguised as a fishing vessel.
test_ted_1368_19	/mnt/zhangyh/DATA/mustc-enes/test-split/test_ted_1368_19.wav	163	Todos los adultos sabían los riesgos.	all the adults knew the risks.
test_ted_1368_20	/mnt/zhangyh/DATA/mustc-enes/test-split/test_ted_1368_20.wav	312	El mayor temor eran los piratas, la violación y la muerte.	the greatest fear was of pirates, rape and death.
test_ted_1368_21	/mnt/zhangyh/DATA/mustc-enes/test-split/test_ted_1368_21.wav	407	Como la mayoría de los adultos, my madre llevaba un frasquito con veneno.	like most adults on the boat, my mother carried a small bottle of poison.
test_ted_1368_22	/mnt/zhangyh/DATA/mustc-enes/test-split/test_ted_1368_22.wav	515	Si nos capturaban, primero lo tomaríamos mi hermana y yo, y luego ella y mi abuela.	if we were captured, first my sister and i, then she and my grandmother would drink.
test_ted_1368_23	/mnt/zhangyh/DATA/mustc-enes/test-split/test_ted_1368_23.wav	919	Mis primeros recuerdos son de ese bote, el ritmo constante del motor, la proa sumergiéndose en cada ola, y el horizonte vasto y vacío.	my first memories are from the boat — the steady beat of the engine, the bow dipping into each wave, the vast and empty horizon.
test_ted_1368_24	/mnt/zhangyh/DATA/mustc-enes/test-split/test_ted_1368_24.wav	976	No recuerdo a los piratas que vinieron varias veces, pero que fueron engañados con la valentía de los hombres en nuestro barco, o el motor muriendo y no pudiendo arrancar por 6 horas.	i don't remember the pirates who came many times, but were bluffed by the bravado of the men on our boat, or the engine dying and failing to start for six hours.
test_ted_1368_25	/mnt/zhangyh/DATA/mustc-enes/test-split/test_ted_1368_25.wav	1427	Pero sí recuerdo las luces de la plataforma petrolera frente a la costa de Malasia, y al hombre joven que colapsó y murió, finalizar el viaje era demasiado para él; y la primera manzana que probé, dada por los hombres de la plataforma.	but i do remember the lights on the oil rig off the malaysian coast and the young man who collapsed and died, the journey's end too much for him, and the first apple i tasted, given to me by the men on the rig.
test_ted_1368_26	/mnt/zhangyh/DATA/mustc-enes/test-split/test_ted_1368_26.wav	226	Ninguna manzana tuvo después el mismo sabor.	no apple has ever tasted the same.
test_ted_1368_27	/mnt/zhangyh/DATA/mustc-enes/test-split/test_ted_1368_27.wav	349	Luego de tres meses en un campo de refugiados, desembarcamos en Melbourne.	after three months in a refugee camp, we landed in melbourne.
test_ted_1368_28	/mnt/zhangyh/DATA/mustc-enes/test-split/test_ted_1368_28.wav	584	Y la próxima pieza del rompecabezas es sobre 4 mujeres a lo largo de 3 generaciones dando forma a una vida nueva juntas.	and the next piece of the jigsaw is about four women across three generations shaping a new life together.
test_ted_1368_29	/mnt/zhangyh/DATA/mustc-enes/test-split/test_ted_1368_29.wav	570	Nos establecimos en Footscray, un suburbio de clase obrera cuya población está compuesta de inmigrantes.	we settled in footscray, a working-class suburb whose demographic is layers of immigrants.
test_ted_1368_30	/mnt/zhangyh/DATA/mustc-enes/test-split/test_ted_1368_30.wav	647	A diferencia de los suburbios de clase media, cuya existencia yo desconocía, en Footscray, no había sentido del derecho.	unlike the settled middle-class suburbs, whose existence i was oblivious of, there was no sense of entitlement in footscray.
test_ted_1368_31	/mnt/zhangyh/DATA/mustc-enes/test-split/test_ted_1368_31.wav	269	Los olores que provenían de las tiendas eran del resto del mundo.	the smells from shop doors were from the rest of the world.
test_ted_1368_32	/mnt/zhangyh/DATA/mustc-enes/test-split/test_ted_1368_32.wav	640	Y los fragmentos de Inglés entrecortado se intercambiaban entre la gente que tenía una cosa en común: estaban empezando de nuevo.	and the snippets of halting english were exchanged between people who had one thing in common: they were starting again.
test_ted_1368_33	/mnt/zhangyh/DATA/mustc-enes/test-split/test_ted_1368_33.wav	559	Mi madre trabajó en granjas, luego en una línea de montaje de autos, trabajando 6 días, doble turno.	my mother worked on farms, then on a car assembly line, working six days, double shifts.
test_ted_1368_34	/mnt/zhangyh/DATA/mustc-enes/test-split/test_ted_1368_34.wav	1938	Aún así, encontró tiempo para estudiar Inglés y obtener un título en TI (tecnología de la información). Éramos pobres. Todos los dólares estaban asignados, y establecida una tutoría extra en Inglés y matemáticas, no importara lo que se debiera quitar, que generalmente era ropa nueva; siempre era de segunda mano.	somehow, she found time to study english and gain it qualifications. we were poor. all the dollars were allocated and extra tuition in english and mathematics was budgeted for regardless of what missed out, which was usually new clothes; they were always secondhand.
test_ted_1368_35	/mnt/zhangyh/DATA/mustc-enes/test-split/test_ted_1368_35.wav	370	Dos pares de medias para la escuela, uno para esconder los agujeros del otro.	two pairs of stockings for school, each to hide the holes in the other.
test_ted_1368_36	/mnt/zhangyh/DATA/mustc-enes/test-split/test_ted_1368_36.wav	400	Un uniforme escolar hasta los tobillos, porque tenía que durar 6 años.	a school uniform down to the ankles, because it had to last for six years.
test_ted_1368_37	/mnt/zhangyh/DATA/mustc-enes/test-split/test_ted_1368_37.wav	898	Y había cantos raros y dolorosos sobre los "ojos rasgados" y algún graffiti: "Asiáticos, vuelvan a casa." ¿A casa, dónde?	and there were rare but searing chants of "slit-eye" and the occasional graffiti: "asian, go home." go home to where?
test_ted_1368_38	/mnt/zhangyh/DATA/mustc-enes/test-split/test_ted_1368_38.wav	160	Algo en mí se endureció.	something stiffened inside me.
test_ted_1368_39	/mnt/zhangyh/DATA/mustc-enes/test-split/test_ted_1368_39.wav	440	Estaba acumulando determinación y una voz que decía: "Voy a superarlos."	there was a gathering of resolve and a quiet voice saying, "i will bypass you."
test_ted_1368_40	/mnt/zhangyh/DATA/mustc-enes/test-split/test_ted_1368_40.wav	332	Mi madre, mi hermana y yo dormíamos en la misma cama.	my mother, my sister and i slept in the same bed.
test_ted_1368_41	/mnt/zhangyh/DATA/mustc-enes/test-split/test_ted_1368_41.wav	714	Mi madre estaba exhausta cada noche, pero nos contábamos sobre nuestro día y escuchábamos los movimientos de nuestra abuela en la casa.	my mother was exhausted each night, but we told one another about our day and listened to the movements of my grandmother around the house.
test_ted_1368_42	/mnt/zhangyh/DATA/mustc-enes/test-split/test_ted_1368_42.wav	271	Mi madre sufría pesadillas, todas del barco.	my mother suffered from nightmares, all about the boat.
test_ted_1368_43	/mnt/zhangyh/DATA/mustc-enes/test-split/test_ted_1368_43.wav	368	Y mi tarea era estar despierta hasta que sus pesadillas comenzaran para poder despertarla.	and my job was to stay awake until her nightmares came so i could wake her.
test_ted_1368_44	/mnt/zhangyh/DATA/mustc-enes/test-split/test_ted_1368_44.wav	455	Ella abrió una tienda de computadoras, luego estudió para ser esteticista y abrió otro negocio.	she opened a computer store, then studied to be a beautician and opened another business.
test_ted_1368_45	/mnt/zhangyh/DATA/mustc-enes/test-split/test_ted_1368_45.wav	851	Y las mujeres venían con sus historias sobre hombres que no podían hacer la transición, enojados e inflexibles, y chicos traumados atrapados entre dos mundos.	and the women came with their stories about men who could not make the transition, angry and inflexible, and troubled children caught between two worlds.
test_ted_1368_46	/mnt/zhangyh/DATA/mustc-enes/test-split/test_ted_1368_46.wav	633	Se buscaron subsidios y patrocinadores. y se crearon centros. Viví en mundos paralelos.	grants and sponsors were sought. centers were established. i lived in parallel worlds.
test_ted_1368_47	/mnt/zhangyh/DATA/mustc-enes/test-split/test_ted_1368_47.wav	539	En uno, era la estudiante asiática clásica, implacable con lo que demandaba de mí misma.	in one, i was the classic asian student, relentless in the demands that i made on myself.
test_ted_1368_48	/mnt/zhangyh/DATA/mustc-enes/test-split/test_ted_1368_48.wav	658	En el otro, estaba enredada en vidas precarias, trágicamente lastimadas por la violencia, el abuso de drogas y el aislamiento.	in the other, i was enmeshed in lives that were precarious, tragically scarred by violence, drug abuse and isolation.
test_ted_1368_49	/mnt/zhangyh/DATA/mustc-enes/test-split/test_ted_1368_49.wav	183	Pero muchos recibieron ayuda a través de los años.	but so many over the years were helped.
test_ted_1368_50	/mnt/zhangyh/DATA/mustc-enes/test-split/test_ted_1368_50.wav	520	Y por ese trabajo, cuando estudiaba mi último año de abogacía, me eligieron la joven australiana del año.	and for that work, when i was a final-year law student, i was chosen as the young australian of the year.
test_ted_1368_51	/mnt/zhangyh/DATA/mustc-enes/test-split/test_ted_1368_51.wav	544	Y fui catapultada de una pieza del rompecabezas a la otra, pero sus bordes no encajaban.	and i was catapulted from one piece of the jigsaw to another, and their edges didn't fit.
test_ted_1368_52	/mnt/zhangyh/DATA/mustc-enes/test-split/test_ted_1368_52.wav	1243	Tan Le, residente anónima de Footscray, era ahora Tan Le, refugiada y activista social, invitada a hablar en sitios que nunca había oído nombrar, y en casas cuya existencia ella nunca hubiera imaginado.	tan le, anonymous footscray resident, was now tan le, refugee and social activist, invited to speak in venues she had never heard of and into homes whose existence she could never have imagined.
test_ted_1368_53	/mnt/zhangyh/DATA/mustc-enes/test-split/test_ted_1368_53.wav	138	Yo no conocía los protocolos.	i didn't know the protocols.
test_ted_1368_54	/mnt/zhangyh/DATA/mustc-enes/test-split/test_ted_1368_54.wav	161	No sabía cómo usar los cubiertos.	i didn't know how to use the cutlery.
test_ted_1368_55	/mnt/zhangyh/DATA/mustc-enes/test-split/test_ted_1368_55.wav	197	No sabía cómo hablar de vino.	i didn't know how to talk about wine.
test_ted_1368_56	/mnt/zhangyh/DATA/mustc-enes/test-split/test_ted_1368_56.wav	204	No sabía cómo hablar de nada.	i didn't know how to talk about anything.
test_ted_1368_57	/mnt/zhangyh/DATA/mustc-enes/test-split/test_ted_1368_57.wav	1831	Quería retirarme a las rutinas y al confort de la vida en un suburbio ignoto — una abuela, una madre y dos hijas terminando el día como lo hicieron por casi 20 años, contándose sobre el día de cada una y quedándose dormidas, las tres todavía en la misma cama.	i wanted to retreat to the routines and comfort of life in an unsung suburb — a grandmother, a mother and two daughters ending each day as they had for almost 20 years, telling one another the story of their day and falling asleep, the three of us still in the same bed.
test_ted_1368_58	/mnt/zhangyh/DATA/mustc-enes/test-split/test_ted_1368_58.wav	173	Y le dije a mi mamá que no podía hacerlo.	i told my mother i couldn't do it.
test_ted_1368_59	/mnt/zhangyh/DATA/mustc-enes/test-split/test_ted_1368_59.wav	1161	Me recordó que yo tenía ahora la misma edad que ella tenía cuando nos subimos al barco. El "no" jamás había sido una opción. "Hazlo", me dijo, "y no seas lo que no sos."	she reminded me that i was now the same age she had been when we boarded the boat. "no" had never been an option. "just do it," she said, "and don't be what you're not."
test_ted_1368_60	/mnt/zhangyh/DATA/mustc-enes/test-split/test_ted_1368_60.wav	609	Así que hablé sobre desocupación juvenil y educación y la desatención a los marginados y los desprotegidos.	so i spoke out on youth unemployment and education and the neglect of the marginalized and disenfranchised.
test_ted_1368_61	/mnt/zhangyh/DATA/mustc-enes/test-split/test_ted_1368_61.wav	330	Y cuanto más francamente hablaba, más era solicitada para hablar.	and the more candidly i spoke, the more i was asked to speak.
test_ted_1368_62	/mnt/zhangyh/DATA/mustc-enes/test-split/test_ted_1368_62.wav	655	Conocí gente de todos los caminos de la vida, muchos de ellos haciendo lo que amaban, viviendo en la frontera de lo posible.	i met people from all walks of life, so many of them doing the thing they loved, living on the frontiers of possibility.
test_ted_1368_63	/mnt/zhangyh/DATA/mustc-enes/test-split/test_ted_1368_63.wav	536	Y aunque terminé mi licenciatura, me di cuenta que no podía quedarme en una carrera de abogacía.	and even though i finished my degree, i realized i could not settle into a career in law.
test_ted_1368_64	/mnt/zhangyh/DATA/mustc-enes/test-split/test_ted_1368_64.wav	192	Tenía que haber otra pieza del rompecabezas.	there had to be another piece of the jigsaw.
test_ted_1368_65	/mnt/zhangyh/DATA/mustc-enes/test-split/test_ted_1368_65.wav	1437	Y me di cuenta al mismo tiempo que está bien ser un desconocido, un recién llegado, nuevo en la escena — y no sólo que está bien, sino que es algo por lo que estar agradecido, quizás un regalo del barco.	and i realized, at the same time, that it is ok to be an outsider, a recent arrival, new on the scene — and not just ok, but something to be thankful for, perhaps a gift from the boat.
test_ted_1368_66	/mnt/zhangyh/DATA/mustc-enes/test-split/test_ted_1368_66.wav	813	Porque estar adentro puede fácilmente significar colapasar los horizontes, puede fácilmente significar aceptar las presunciones de tu provincia.	because being an insider can so easily mean collapsing the horizons, can so easily mean accepting the presumptions of your province.
test_ted_1368_67	/mnt/zhangyh/DATA/mustc-enes/test-split/test_ted_1368_67.wav	667	Di los suficientes pasos fuera de mi zona de confort para saber que, sí, que el mundo se desmorona, pero no de la manera que tememos.	i have stepped outside my comfort zone enough now to know that, yes, the world does fall apart, but not in the way that you fear.
test_ted_1368_68	/mnt/zhangyh/DATA/mustc-enes/test-split/test_ted_1368_68.wav	390	Posibilidades que no hubieran sido permitidas eran alentadas tremendamente.	possibilities that would not have been allowed were outrageously encouraged.
test_ted_1368_69	/mnt/zhangyh/DATA/mustc-enes/test-split/test_ted_1368_69.wav	603	Había una energía ahí, un optimismo implacable, una mezcla rara de humildad y valentía.	there was an energy there, an implacable optimism, a strange mixture of humility and daring.
test_ted_1368_70	/mnt/zhangyh/DATA/mustc-enes/test-split/test_ted_1368_70.wav	123	Así que seguí mi intuición.	so i followed my hunches.
test_ted_1368_71	/mnt/zhangyh/DATA/mustc-enes/test-split/test_ted_1368_71.wav	611	Junté a un pequeño grupo de personas para quienes el lema "No puede hacerse" era un desafío irresistible.	i gathered around me a small team of people for whom the label "it can't be done" was an irresistible challenge.
test_ted_1368_72	/mnt/zhangyh/DATA/mustc-enes/test-split/test_ted_1368_72.wav	140	Por un año no tuvimos un centavo.	for a year, we were penniless.
test_ted_1368_73	/mnt/zhangyh/DATA/mustc-enes/test-split/test_ted_1368_73.wav	342	Al final de cada día, hacía una olla gigante de sopa que todos compartíamos.	at the end of each day, i made a huge pot of soup which we all shared.
test_ted_1368_74	/mnt/zhangyh/DATA/mustc-enes/test-split/test_ted_1368_74.wav	150	Trabajábamos hasta bien entrada la noche.	we worked well into each night.
test_ted_1368_75	/mnt/zhangyh/DATA/mustc-enes/test-split/test_ted_1368_75.wav	504	La mayoría de nuestras ideas eran locas, pero algunas brillantes, y nos abrimos paso.	most of our ideas were crazy, but a few were brilliant, and we broke through.
test_ted_1368_76	/mnt/zhangyh/DATA/mustc-enes/test-split/test_ted_1368_76.wav	990	Tomé la decisión de mudarme a los EE.UU. luego de un sólo viaje. Mis corazonadas nuevamente. Tres meses después me había mudado, y la aventura continuaba.	i made the decision to move to the us after only one trip. my hunches again. three months later, i had relocated, and the adventure has continued.
test_ted_1368_77	/mnt/zhangyh/DATA/mustc-enes/test-split/test_ted_1368_77.wav	293	Antes de terminar, permítanme contarles sobre mi abuela.	before i close, though, let me tell you about my grandmother.
test_ted_1368_78	/mnt/zhangyh/DATA/mustc-enes/test-split/test_ted_1368_78.wav	586	Ella creció en una época en la que el Confusionismo era la norma social y el Mandarín local era la persona que importaba.	she grew up at a time when confucianism was the social norm and the local mandarin was the person who mattered.
test_ted_1368_79	/mnt/zhangyh/DATA/mustc-enes/test-split/test_ted_1368_79.wav	182	La vida no había cambiado por siglos.	life hadn't changed for centuries.
test_ted_1368_80	/mnt/zhangyh/DATA/mustc-enes/test-split/test_ted_1368_80.wav	249	Su padre murió poco después de que ella nació.	her father died soon after she was born.
test_ted_1368_81	/mnt/zhangyh/DATA/mustc-enes/test-split/test_ted_1368_81.wav	136	La madre la crió sola.	her mother raised her alone.
test_ted_1368_82	/mnt/zhangyh/DATA/mustc-enes/test-split/test_ted_1368_82.wav	461	A los 17 se convirtió en concubina de un Mandarín cuya madre la golpeaba.	at 17, she became the second wife of a mandarin whose mother beat her.
test_ted_1368_83	/mnt/zhangyh/DATA/mustc-enes/test-split/test_ted_1368_83.wav	1819	Sin apoyo de su marido, causó un revuelo al demandarlo y llevar la causa ella misma, y mucho más revuelvo causó cuando ganó. (Risas) (Aplausos) El “no puede hacerse ” demostró ser erróneo.	with no support from her husband, she caused a sensation by taking him to court and prosecuting her own case, and a far greater sensation when she won. (laughter) (applause) "it can't be done" was shown to be wrong.
test_ted_1368_84	/mnt/zhangyh/DATA/mustc-enes/test-split/test_ted_1368_84.wav	698	Estaba en la ducha en el cuarto de un hotel en Sidney cuando ella murió, a 1 000 km, en Melbourne.	i was taking a shower in a hotel room in sydney the moment she died, 600 miles away, in melbourne.
test_ted_1368_85	/mnt/zhangyh/DATA/mustc-enes/test-split/test_ted_1368_85.wav	327	Miré a través de la mampara de la ducha y la vi parada del otro lado.	i looked through the shower screen and saw her standing on the other side.
test_ted_1368_86	/mnt/zhangyh/DATA/mustc-enes/test-split/test_ted_1368_86.wav	167	Supe que había venido a despedirse.	i knew she had come to say goodbye.
test_ted_1368_87	/mnt/zhangyh/DATA/mustc-enes/test-split/test_ted_1368_87.wav	158	Mi madre llamó minutos después.	my mother phoned minutes later.
test_ted_1368_88	/mnt/zhangyh/DATA/mustc-enes/test-split/test_ted_1368_88.wav	454	Días más tarde, fuimos a un templo budista en Footscray y nos sentamos alrededor de su ataúd.	a few days later, we went to a buddhist temple in footscray and sat around her casket.
test_ted_1368_89	/mnt/zhangyh/DATA/mustc-enes/test-split/test_ted_1368_89.wav	335	Le contamos historias y le aseguramos que estábamos aún con ella.	we told her stories and assured her that we were still with her.
test_ted_1368_90	/mnt/zhangyh/DATA/mustc-enes/test-split/test_ted_1368_90.wav	452	A la noche un monje vino y nos dijo que tenía que cerrar el ataúd.	at midnight, the monk came and told us he had to close the casket.
test_ted_1368_91	/mnt/zhangyh/DATA/mustc-enes/test-split/test_ted_1368_91.wav	219	Mi madre nos pidió que sintiéramos su mano.	my mother asked us to feel her hand.
test_ted_1368_92	/mnt/zhangyh/DATA/mustc-enes/test-split/test_ted_1368_92.wav	1229	Le preguntó al monje: "¿Por qué su mano está caliente, y el resto del cuerpo tan frío?" "Porque Uds. han tomado su mano desde la mañana," dijo. "No la han soltado."	she asked the monk, "why is it that her hand is so warm and the rest of her is so cold?" "because you have been holding it since this morning," he said. "you have not let it go."
test_ted_1368_93	/mnt/zhangyh/DATA/mustc-enes/test-split/test_ted_1368_93.wav	368	Si hay un nervio en nuestra familia, ese corre a través de las mujeres.	if there is a sinew in our family, it runs through the women.
test_ted_1368_94	/mnt/zhangyh/DATA/mustc-enes/test-split/test_ted_1368_94.wav	734	Dado quienes éramos y cómo la vida nos formó, ahora podemos ver que los hombres que hubieran llegado a nuestras vidas nos habrían frustrado.	given who we were and how life had shaped us, we can now see that the men that might have come into our lives would have thwarted us.
test_ted_1368_95	/mnt/zhangyh/DATA/mustc-enes/test-split/test_ted_1368_95.wav	175	La derrota hubiera acontecido fácilmente.	defeat would have come too easily.
test_ted_1368_96	/mnt/zhangyh/DATA/mustc-enes/test-split/test_ted_1368_96.wav	693	Ahora quiero tener mis propios hijos, y me pregunto sobre el barco. ¿Quién podría desear eso para sí?	now i would like to have my own children, and i wonder about the boat. who could ever wish it on their own?
test_ted_1368_97	/mnt/zhangyh/DATA/mustc-enes/test-split/test_ted_1368_97.wav	3316	Sin embargo, le temo al privilegio de lo fácil, del derecho. ¿Puedo darles una proa en sus vidas, sumergiéndose valiente en cada ola, el impávido ritmo constante del motor, el vasto horizonte que no garantiza nada? No lo sé. Pero si pudiera darlo y verlos a salvo, lo haría.	yet i am afraid of privilege, of ease, of entitlement. can i give them a bow in their lives, dipping bravely into each wave, the unperturbed and steady beat of the engine, the vast horizon that guarantees nothing? i don't know. but if i could give it and still see them safely through, i would.
test_ted_1368_98	/mnt/zhangyh/DATA/mustc-enes/test-split/test_ted_1368_98.wav	10	(Aplausos)	(applause)
test_ted_1368_99	/mnt/zhangyh/DATA/mustc-enes/test-split/test_ted_1368_99.wav	808	Trevor Neilson y también la madre de Tan está hoy aquí, en la cuarta o quinta fila.	trevor neilson: and also, tan's mother is here today, in the fourth or fifth row.
test_ted_1371_0	/mnt/zhangyh/DATA/mustc-enes/test-split/test_ted_1371_0.wav	1197	Hola. Soy Kevin Allocca, el gerente de tendencias de YouTube; y miro videos de YouTube en forma profesional. Es cierto. Por eso hoy veremos por qué los videos se hacen virales y qué importancia tiene eso.	hi. i'm kevin allocca, i'm the trends manager at youtube, and i professionally watch youtube videos. it's true. so we're going to talk a little bit today about how videos go viral and then why that even matters.
test_ted_1371_1	/mnt/zhangyh/DATA/mustc-enes/test-split/test_ted_1371_1.wav	756	Todos queremos ser estrellas: celebridades, cantantes, comediantes... Cuando yo era más joven, eso parecía algo muy, muy difícil.	we all want to be stars — celebrities, singers, comedians — and when i was younger, that seemed so very, very hard to do.
test_ted_1371_2	/mnt/zhangyh/DATA/mustc-enes/test-split/test_ted_1371_2.wav	689	Pero hoy el video web hace que cualquiera de nosotros, o de nuestras acciones, cobre notoriedad en una parte de nuestra cultura mundial.	but now web video has made it so that any of us or any of the creative things that we do can become completely famous in a part of our world's culture.
test_ted_1371_3	/mnt/zhangyh/DATA/mustc-enes/test-split/test_ted_1371_3.wav	288	Cualquiera puede hacerse famoso en Internet en un santiamén.	any one of you could be famous on the internet by next saturday.
