id	audio	n_frames	tgt_text	src_text
test_ted_1144_5	/mnt/zhangyh/DATA/mustc-enes/test-split/test_ted_1144_5.wav	210	Crecí en la India.	and i grew up in india.
test_ted_1144_6	/mnt/zhangyh/DATA/mustc-enes/test-split/test_ted_1144_6.wav	598	Goce de una gran educación -no me quejo- pero no tenía acceso a muchos de estos museos y obras de arte.	i had a great education — i'm not complaining — but i didn't have access to a lot of these museums and these artworks.
test_ted_1144_7	/mnt/zhangyh/DATA/mustc-enes/test-split/test_ted_1144_7.wav	411	Por eso, cuando comencé a viajar e ir a museos, comencé a aprender mucho.	and so when i started traveling and going to these museums, i started learning a lot.
test_ted_1144_8	/mnt/zhangyh/DATA/mustc-enes/test-split/test_ted_1144_8.wav	705	Y trabajando en Google, intento hacer realidad el deseo de hacerlo más accesible mediante tecnología.	and while working at google, i tried to put this desire to make it more accessible with technology together.
test_ted_1144_9	/mnt/zhangyh/DATA/mustc-enes/test-split/test_ted_1144_9.wav	463	Así que formamos un equipo, un gran equipo de personas, y empezamos a hacerlo.	so we formed a team, a great team of people, and we started doing this.
test_ted_1144_10	/mnt/zhangyh/DATA/mustc-enes/test-split/test_ted_1144_10.wav	562	Mejor que muestre la demo para luego explicarles un par de cosas interesantes que hemos llevado a cabo desde su lanzamiento.	i'm going to probably get into the demo and then tell you a couple of the interesting things we've had since launch.
test_ted_1144_11	/mnt/zhangyh/DATA/mustc-enes/test-split/test_ted_1144_11.wav	595	Así que, simplemente: vamos a GoogleArtProject.com. Miren alrededor todos los museos que hay.	so, simple: you come to googleartproject.com. you look around at all these museums here.
test_ted_1144_12	/mnt/zhangyh/DATA/mustc-enes/test-split/test_ted_1144_12.wav	397	Está la galería Uffizi, el MoMA, el Ermitage, el Rijksmuseum, el Van Gogh.	you've got the uffizi, you've got the moma, the hermitage, the rijks, the van gogh.
test_ted_1144_13	/mnt/zhangyh/DATA/mustc-enes/test-split/test_ted_1144_13.wav	488	De hecho voy a entrar en uno de mis favoritos, al Metropolitan, el museo de arte de Nueva York.	i'm going to actually get to one of my favorites, the metropolitan museum of art in new york.
test_ted_1144_14	/mnt/zhangyh/DATA/mustc-enes/test-split/test_ted_1144_14.wav	238	Hay dos maneras de hacerlo - muy sencillo.	two ways of going in — very simple.
test_ted_1144_15	/mnt/zhangyh/DATA/mustc-enes/test-split/test_ted_1144_15.wav	248	Hacemos clic y, ¡pam!, ya estamos dentro del museo.	click and, bang, you're in this museum.
test_ted_1144_16	/mnt/zhangyh/DATA/mustc-enes/test-split/test_ted_1144_16.wav	372	No importa dónde estén, Bombay o Méjico, eso en realidad no importa.	it doesn't matter where you are — bombay, mexico, it doesn't really matter.
test_ted_1144_17	/mnt/zhangyh/DATA/mustc-enes/test-split/test_ted_1144_17.wav	343	Ustedes se mueven por ahí y se divierten. ¿Quieren navegar por el museo?	you move around, you have fun. you want to navigate around the museum?
test_ted_1144_18	/mnt/zhangyh/DATA/mustc-enes/test-split/test_ted_1144_18.wav	304	Abrimos el plano de arriba, y, con un solo clic, saltamos dentro.	open the plan up, and, in one click, jump.
test_ted_1144_19	/mnt/zhangyh/DATA/mustc-enes/test-split/test_ted_1144_19.wav	502	Están dentro, que desean ir al final del pasillo, sigan hacia adelante. ¡Que se diviertan! Exploren.	you're in there, you want to go to the end of the corridor. keep going. have fun. explore.
test_ted_1144_21	/mnt/zhangyh/DATA/mustc-enes/test-split/test_ted_1144_21.wav	133	Gracias, pero no he llegado a lo mejor.	thanks. i haven't come to the best part.
test_ted_1144_23	/mnt/zhangyh/DATA/mustc-enes/test-split/test_ted_1144_23.wav	718	Ahora estoy delante de una de mis pinturas favoritas, "Los cosechadores" de Pieter Breugel en el Metropolitan.	so now i'm in front of one of my favorite paintings, "the harvesters" by pieter bruegel at the met.
test_ted_1144_24	/mnt/zhangyh/DATA/mustc-enes/test-split/test_ted_1144_24.wav	101	Veo el signo +.	i see this plus sign.
test_ted_1144_25	/mnt/zhangyh/DATA/mustc-enes/test-split/test_ted_1144_25.wav	211	Si el museo nos muestra la imagen, hacemos clic ahí.	if the museum has given us the image, you click on it.
test_ted_1144_26	/mnt/zhangyh/DATA/mustc-enes/test-split/test_ted_1144_26.wav	114	Miren, ésta es una de las imágenes.	now this is one of the images.
test_ted_1144_27	/mnt/zhangyh/DATA/mustc-enes/test-split/test_ted_1144_27.wav	189	Aquí está toda la información de metadatos.	so this is all of the meta-data information.
test_ted_1144_28	/mnt/zhangyh/DATA/mustc-enes/test-split/test_ted_1144_28.wav	487	Para aquellos de ustedes que estén verdaderamente interesados en el arte, pueden hacer clic ahí; pero yo voy a hacer clic aquí ahora mismo.	for those of you who are truly interested in art, you can click this — but i'm going to click this off right now.
test_ted_1144_29	/mnt/zhangyh/DATA/mustc-enes/test-split/test_ted_1144_29.wav	382	Y esta es una de las imágenes que hemos capturado en lo que llamamos la tecnología gigapixel.	and this is one of these images that we captured in what we call gigapixel technology.
test_ted_1144_30	/mnt/zhangyh/DATA/mustc-enes/test-split/test_ted_1144_30.wav	407	Así que esta imagen, por ejemplo, contiene, creo, unos 10.000 millones de píxeles.	so this image, for example, has close to, i think, around 10 billion pixels.
test_ted_1144_31	/mnt/zhangyh/DATA/mustc-enes/test-split/test_ted_1144_31.wav	687	Y hay muchas personas que me preguntan: "¿Y qué se obtiene con 10.000 millones de píxeles?" Así que les mostraré lo que realmente se consigue con 10.000 millones de píxeles.	and i get a lot of people asking me: "what do you get for 10 billion pixels?" so i'm going to try and show you what you really get for 10 billion pixels.
test_ted_1144_32	/mnt/zhangyh/DATA/mustc-enes/test-split/test_ted_1144_32.wav	172	Puede hacer zoom alrededor de manera muy sencilla.	you can zoom around very simply.
test_ted_1144_33	/mnt/zhangyh/DATA/mustc-enes/test-split/test_ted_1144_33.wav	188	Se ven cosas divertidas que están sucediendo.	you see some fun stuff happening here.
test_ted_1144_34	/mnt/zhangyh/DATA/mustc-enes/test-split/test_ted_1144_34.wav	245	Me encanta este chico, su expresión no tiene precio.	i love this guy; his expression is priceless.
test_ted_1144_35	/mnt/zhangyh/DATA/mustc-enes/test-split/test_ted_1144_35.wav	228	Pero si realmente desearan profundizar.	but then you really want to go deep.
test_ted_1144_36	/mnt/zhangyh/DATA/mustc-enes/test-split/test_ted_1144_36.wav	372	Así es que empecé a jugar, y me encontré con algo que sucedía ahí.	and so i started playing around, and i found something going on over here.
test_ted_1144_37	/mnt/zhangyh/DATA/mustc-enes/test-split/test_ted_1144_37.wav	742	Y me dije: "Un momento, esto parece interesante." Entré y descubrí que los niños estaban en realidad jugando a algo.	and i was like, "hold on. that sounds interesting." went in, and i started noticing that these kids were actually beating something.
test_ted_1144_38	/mnt/zhangyh/DATA/mustc-enes/test-split/test_ted_1144_38.wav	1069	Investigué un poco, hablé con algunas personas del Metropolitan, y en realidad descubrí que este es un juego denominado [incomprensible], que consiste en golpear una oca con un palo el martes de Carnaval.	i did a little research, spoke to a couple of my contacts at the met, and actually found out that this is a game called squall, which involves beating a goose with a stick on shrove tuesday.
test_ted_1144_39	/mnt/zhangyh/DATA/mustc-enes/test-split/test_ted_1144_39.wav	186	Y al parecer era muy popular.	and apparently it was quite popular.
test_ted_1144_40	/mnt/zhangyh/DATA/mustc-enes/test-split/test_ted_1144_40.wav	273	No sé por qué lo hacían, pero he aprendido algo al respecto.	i don't know why they did it, but i learned something about it.
test_ted_1144_41	/mnt/zhangyh/DATA/mustc-enes/test-split/test_ted_1144_41.wav	330	Y ahora vamos a meternos aún más en profundidad y verán que realmente se puede llegar incluso a las grietas.	now just to get really deep in, you can really get to the cracks.
test_ted_1144_42	/mnt/zhangyh/DATA/mustc-enes/test-split/test_ted_1144_42.wav	395	Ahora sólo para darles un poco de perspectiva, Voy a alejar la imagen, así verán realmente lo que hay.	now just to give you some perspective, i'm going to zoom out so you really see what you get.
test_ted_1144_43	/mnt/zhangyh/DATA/mustc-enes/test-split/test_ted_1144_43.wav	369	Aquí es donde estábamos, y ésta es la pintura.	here is where we were, and this is the painting.
test_ted_1144_44	/mnt/zhangyh/DATA/mustc-enes/test-split/test_ted_1144_44.wav	7	(Aplausos)	(applause)
test_ted_1144_45	/mnt/zhangyh/DATA/mustc-enes/test-split/test_ted_1144_45.wav	918	Lo mejor está por venir, un segundo.	the best is yet to come — so in a second.
test_ted_1144_46	/mnt/zhangyh/DATA/mustc-enes/test-split/test_ted_1144_46.wav	471	Así que ahora vamos rápidamente a saltar otra vez al MoMA en Nueva York.	so now let's just quickly jump into the moma, again in new york.
test_ted_1144_47	/mnt/zhangyh/DATA/mustc-enes/test-split/test_ted_1144_47.wav	498	Aquí otro de mis favoritos, "La noche estrellada." El ejemplo que mostré era para encontrar detalles.	so another one of my favorites, "the starry night." now the example i showed you was all about finding details.
test_ted_1144_48	/mnt/zhangyh/DATA/mustc-enes/test-split/test_ted_1144_48.wav	768	Pero ¿qué pasa si se desea ver las pinceladas? ¿Y si quieren ver cómo Van Gogh en realidad creó esta obra maestra?	but what if you want to see brush strokes? and what if you want to see how van gogh actually created this masterpiece? you zoom in. you really go in.
test_ted_1144_49	/mnt/zhangyh/DATA/mustc-enes/test-split/test_ted_1144_49.wav	442	Voy a una de mis partes favoritas en este cuadro, Y realmente voy a llegar a las grietas.	i'm going to go to one of my favorite parts in this painting, and i'm really going to get to the cracks.
test_ted_1144_50	/mnt/zhangyh/DATA/mustc-enes/test-split/test_ted_1144_50.wav	499	Esta es "la noche estrellada", Creo que nunca la había visto así antes.	this is "the starry night," i think, never seen like this before.
test_ted_1144_51	/mnt/zhangyh/DATA/mustc-enes/test-split/test_ted_1144_51.wav	170	Les voy a mostrar otra de mis funciones favoritas.	i'm going to show you my other favorite feature.
test_ted_1144_52	/mnt/zhangyh/DATA/mustc-enes/test-split/test_ted_1144_52.wav	185	Hay muchas cosas cosas más aquí, pero no tengo tiempo de mostrarlas.	there's a lot of other stuff here, but i don't have time.
test_ted_1144_53	/mnt/zhangyh/DATA/mustc-enes/test-split/test_ted_1144_53.wav	128	Esta es la parte realmente genial.	this is the real cool part.
test_ted_1144_54	/mnt/zhangyh/DATA/mustc-enes/test-split/test_ted_1144_54.wav	109	Se llama "Colecciones".	it's called collections.
test_ted_1144_55	/mnt/zhangyh/DATA/mustc-enes/test-split/test_ted_1144_55.wav	680	Todos ustedes, absolutamente todos, no importa si se es rico o pobre, o si se tiene una mansión, eso da igual.	any one of you, anybody — doesn't matter if you're rich, if you're poor, if you have a fancy house — doesn't matter.
test_ted_1144_56	/mnt/zhangyh/DATA/mustc-enes/test-split/test_ted_1144_56.wav	430	Ustedes pueden en línea crear su propio museo, crear su propia colección a partir de todas estas imágenes.	you can go and create your own museum online — create your own collection across all these images.
test_ted_1144_57	/mnt/zhangyh/DATA/mustc-enes/test-split/test_ted_1144_57.wav	559	Es muy sencillo, entramos, - he creado esta función que llamo "El poder del zoom", - acabamos de hacer un zoom alrededor.	very simply, you go in — and i've created this, called the power of zoom — you can just zoom around.
test_ted_1144_58	/mnt/zhangyh/DATA/mustc-enes/test-split/test_ted_1144_58.wav	288	Se trata de "Los embajadores" en la Galería Nacional de Londres.	this is "the ambassadors," based in the national gallery.
test_ted_1144_59	/mnt/zhangyh/DATA/mustc-enes/test-split/test_ted_1144_59.wav	724	Ustedes pueden anotar cosas, enviarlo a sus amigos y mantener una conversación acerca de lo que sienten al contemplar estas obras maestras.	you can annotate the stuff, send it to your friends and really get a conversation going about what you're feeling when you go through these masterpieces.
test_ted_1144_60	/mnt/zhangyh/DATA/mustc-enes/test-split/test_ted_1144_60.wav	718	Así que en conclusión, creo que para mí, lo principal es que todas las cosas increíbles realmente no provienen de Google.	so i think, in conclusion, for me, the main thing is that all the amazing stuff here does not really come from google.
test_ted_1144_61	/mnt/zhangyh/DATA/mustc-enes/test-split/test_ted_1144_61.wav	223	No, en mi opinión, incluso tampoco provienen de los museos.	it doesn't, in my opinion, even come from the museums.
test_ted_1144_62	/mnt/zhangyh/DATA/mustc-enes/test-split/test_ted_1144_62.wav	63	Quizá no debería decir esto.	i probably shouldn't say that.
test_ted_1144_63	/mnt/zhangyh/DATA/mustc-enes/test-split/test_ted_1144_63.wav	200	En realidad, provienen de esos artistas.	it really comes from these artists.
test_ted_1144_64	/mnt/zhangyh/DATA/mustc-enes/test-split/test_ted_1144_64.wav	235	Y esa ha sido mi humilde experiencia con esto.	and that's been my humbling experience in this.
test_ted_1144_65	/mnt/zhangyh/DATA/mustc-enes/test-split/test_ted_1144_65.wav	622	Quiero decir, espero que en este medio digital haga justicia a su obra de arte y que esté representada adecuadamente en línea.	i mean, i hope in this digital medium that we do justice to their artwork and represent it properly online.
test_ted_1144_66	/mnt/zhangyh/DATA/mustc-enes/test-split/test_ted_1144_66.wav	805	Y la gran pregunta que me hacen hoy en día es: "¿Usted hizo esto para repetir la experiencia de ir a un museo?" Y la respuesta es no.	and the biggest question i get asked nowadays is, "did you do this to replicate the experience of going to a museum?" and the answer is no.
test_ted_1144_67	/mnt/zhangyh/DATA/mustc-enes/test-split/test_ted_1144_67.wav	203	Es para complementar la experiencia.	it's to supplement the experience.
test_ted_1144_68	/mnt/zhangyh/DATA/mustc-enes/test-split/test_ted_1144_68.wav	116	Y eso es todo. Gracias.	and that's it. thank you.
test_ted_1144_70	/mnt/zhangyh/DATA/mustc-enes/test-split/test_ted_1144_70.wav	5	Gracias.	thank you.
test_ted_1160_0	/mnt/zhangyh/DATA/mustc-enes/test-split/test_ted_1160_0.wav	411	Esta es una representación de tu cerebro que podemos dividir en dos partes.	this is a representation of your brain, and your brain can be broken into two parts.
test_ted_1160_1	/mnt/zhangyh/DATA/mustc-enes/test-split/test_ted_1160_1.wav	515	El lado izquierdo, que es la parte lógica, y el lado derecho, que es la parte intuitiva.	there's the left half, which is the logical side, and then the right half, which is the intuitive.
test_ted_1160_2	/mnt/zhangyh/DATA/mustc-enes/test-split/test_ted_1160_2.wav	483	Por lo tanto, si utilizáramos una escala para medir la aptitud de cada hemisferio, podríamos diseñar un plano de nuestro cerebro.	and so if we had a scale to measure the aptitude of each hemisphere, then we can plot our brain.
test_ted_1160_3	/mnt/zhangyh/DATA/mustc-enes/test-split/test_ted_1160_3.wav	298	Por ejemplo, éste sería alguien que es completamente lógico.	and for example, this would be somebody who's completely logical.
test_ted_1160_4	/mnt/zhangyh/DATA/mustc-enes/test-split/test_ted_1160_4.wav	244	Este sería alguien que es totalmente intuitivo.	this would be someone who's entirely intuitive.
test_ted_1160_5	/mnt/zhangyh/DATA/mustc-enes/test-split/test_ted_1160_5.wav	229	Entonces, ¿Dónde ubicarías tu cerebro en esta escala?	so where would you put your brain on this scale?
test_ted_1160_6	/mnt/zhangyh/DATA/mustc-enes/test-split/test_ted_1160_6.wav	976	Algunos optarían por uno de estos extremos, pero creo que para la mayoría de los integrantes de esta audiencia, su cerebro es algo así — con una gran aptitud en ambos hemisferios al mismo tiempo.	some of us may have opted for one of these extremes, but i think for most people in the audience, your brain is something like this — with a high aptitude in both hemispheres at the same time.
test_ted_1160_7	/mnt/zhangyh/DATA/mustc-enes/test-split/test_ted_1160_7.wav	397	No es que sean mutuamente exclusivos, Puedes ser lógico e intuitivo.	it's not like they're mutually exclusive or anything. you can be logical and intuitive.
test_ted_1160_8	/mnt/zhangyh/DATA/mustc-enes/test-split/test_ted_1160_8.wav	930	Yo me considero una de esas personas, que al igual que la mayoría de los otros físicos cuánticos experimentales, necesitamos bastante lógica para concatenar estas complicadas ideas.	and so i consider myself one of these people, along with most of the other experimental quantum physicists, who need a good deal of logic to string together these complex ideas.
test_ted_1160_9	/mnt/zhangyh/DATA/mustc-enes/test-split/test_ted_1160_9.wav	661	Pero al mismo tiempo, necesitamos bastante intuición para hacer que los experimentos realmente funcionen. ¿Cómo desarrollamos esta intuición?	but at the same time, we need a good deal of intuition to actually make the experiments work. how do we develop this intuition?
test_ted_1160_10	/mnt/zhangyh/DATA/mustc-enes/test-split/test_ted_1160_10.wav	116	Bueno, nos gusta jugar con cosas.	well we like to play with stuff.
test_ted_1160_11	/mnt/zhangyh/DATA/mustc-enes/test-split/test_ted_1160_11.wav	441	Nos ponemos a jugar con ellas y luego vemos como reaccionan. Y luego desarrollamos nuestra intuición a partir de ese punto.	so we go out and play with it, and then we see how it acts, and then we develop our intuition from there.
test_ted_1160_12	/mnt/zhangyh/DATA/mustc-enes/test-split/test_ted_1160_12.wav	297	Y en realidad, ustedes hacen lo mismo.	and really you do the same thing.
test_ted_1160_13	/mnt/zhangyh/DATA/mustc-enes/test-split/test_ted_1160_13.wav	743	Cierta intuición que pueden haber desarrollado con el paso de los años es la que dice que una cosa puede estar solo en un lugar a la vez.	so some intuition that you may have developed over the years is that one thing is only in one place at a time.
test_ted_1160_14	/mnt/zhangyh/DATA/mustc-enes/test-split/test_ted_1160_14.wav	909	Es decir, puede sonar raro pensar que una cosa esté en dos lugares diferentes al mismo tiempo, pero ustedes no nacieron con esta noción, la desarrollaron.	i mean, it can sound weird to think about one thing being in two different places at the same time, but you weren't born with this notion, you developed it.
test_ted_1160_15	/mnt/zhangyh/DATA/mustc-enes/test-split/test_ted_1160_15.wav	256	Recuerdo observar a un niño jugando en una barra de estacionamiento.	and i remember watching a kid playing on a car stop.
test_ted_1160_16	/mnt/zhangyh/DATA/mustc-enes/test-split/test_ted_1160_16.wav	326	Era un niño pequeño y no lo hacía muy bien, siempre se caía.	he was just a toddler and he wasn't very good at it, and he kept falling over.
test_ted_1160_17	/mnt/zhangyh/DATA/mustc-enes/test-split/test_ted_1160_17.wav	866	Pero apuesto que el jugar con esa barra de estacionamiento le enseñó una valiosa lección, y es que las cosas grandes no permiten que las traspasen, y que permanecen en un lugar.	but i bet playing with this car stop taught him a really valuable lesson, and that's that large things don't let you get right past them, and that they stay in one place.
test_ted_1160_18	/mnt/zhangyh/DATA/mustc-enes/test-split/test_ted_1160_18.wav	518	Éste es un gran modelo conceptual que se puede tener del mundo, salvo que seas un físico de partículas.	and so this is a great conceptual model to have of the world, unless you're a particle physicist.
test_ted_1160_19	/mnt/zhangyh/DATA/mustc-enes/test-split/test_ted_1160_19.wav	659	Sería un modelo terrible para un físico de partículas, ya que ellos no juegan con barras de estacionamiento, juegan con estas extrañas pequeñas partículas.	it'd be a terrible model for a particle physicist, because they don't play with car stops, they play with these little weird particles.
test_ted_1160_20	/mnt/zhangyh/DATA/mustc-enes/test-split/test_ted_1160_20.wav	958	Y cuando juegan con sus partículas, descubren que ellas hacen toda clases de cosas realmente raras — como que pueden atravesar paredes, o que pueden estar en dos lugares diferentes al mismo tiempo.	and when they play with their particles, they find they do all sorts of really weird things — like they can fly right through walls, or they can be in two different places at the same time.
test_ted_1160_21	/mnt/zhangyh/DATA/mustc-enes/test-split/test_ted_1160_21.wav	584	Y entonces escribieron todas estas observaciones, y la llamaron teoría de la mecánica cuántica.	and so they wrote down all these observations, and they called it the theory of quantum mechanics.
test_ted_1160_22	/mnt/zhangyh/DATA/mustc-enes/test-split/test_ted_1160_22.wav	784	En ese punto se encontraba la física algunos años atrás; necesitabas de la mecánica cuántica para describir esas pequeñas partículas.	and so that's where physics was at a few years ago; you needed quantum mechanics to describe little, tiny particles.
test_ted_1160_23	/mnt/zhangyh/DATA/mustc-enes/test-split/test_ted_1160_23.wav	498	Pero no la necesitabas para describir los objetos grandes que nos rodean todos los días.	but you didn't need it to describe the large, everyday objects around us.
test_ted_1160_24	/mnt/zhangyh/DATA/mustc-enes/test-split/test_ted_1160_24.wav	584	Eso no se ajustaba muy bien a mi intuición, y quizás sea porque no juego muy a menudo con partículas.	this didn't really sit well with my intuition, and maybe it's just because i don't play with particles very often.
test_ted_1160_25	/mnt/zhangyh/DATA/mustc-enes/test-split/test_ted_1160_25.wav	303	Bueno, a veces juego con ellas, pero no mucho.	well, i play with them sometimes, but not very often.
test_ted_1160_26	/mnt/zhangyh/DATA/mustc-enes/test-split/test_ted_1160_26.wav	112	Y nunca las he visto.	and i've never seen them.
test_ted_1160_27	/mnt/zhangyh/DATA/mustc-enes/test-split/test_ted_1160_27.wav	246	Es decir, nunca nadie vio una partícula.	i mean, nobody's ever seen a particle.
test_ted_1160_28	/mnt/zhangyh/DATA/mustc-enes/test-split/test_ted_1160_28.wav	243	Pero tampoco se ajustaba bien a mi parte lógica.	but it didn't sit well with my logical side either.
test_ted_1160_29	/mnt/zhangyh/DATA/mustc-enes/test-split/test_ted_1160_29.wav	1005	Porque si todo está hecho de pequeñas partículas y todas las pequeñas partículas siguen los principios de la mecánica cuántica, entonces ¿No debería todo seguir los principios de la mecánica cuántica?	because if everything is made up of little particles and all the little particles follow quantum mechanics, then shouldn't everything just follow quantum mechanics?
test_ted_1160_30	/mnt/zhangyh/DATA/mustc-enes/test-split/test_ted_1160_30.wav	156	No encuentro la razón por la cual no debería.	i don't see any reason why it shouldn't.
test_ted_1160_31	/mnt/zhangyh/DATA/mustc-enes/test-split/test_ted_1160_31.wav	729	Y por lo tanto me sentiría mucho mejor si pudiera de alguna forma demostrar que un objeto común también sigue los principios de la mecánica cuántica.	and so i'd feel a lot better about the whole thing if we could somehow show that an everyday object also follows quantum mechanics.
test_ted_1160_32	/mnt/zhangyh/DATA/mustc-enes/test-split/test_ted_1160_32.wav	270	Es por eso que hace algunos años, me propuse hacer exactamente eso.	so a few years ago, i set off to do just that.
test_ted_1160_33	/mnt/zhangyh/DATA/mustc-enes/test-split/test_ted_1160_33.wav	900	Y lo hice. Este es el primer objeto que pueden ver que ha estado en una superposición de mecánica cuántica.	so i made one. this is the first object that you can see that has been in a mechanical quantum superposition.
test_ted_1160_34	/mnt/zhangyh/DATA/mustc-enes/test-split/test_ted_1160_34.wav	268	Lo que vemos aquí es un pequeño chip de computadora.	so what we're looking at here is a tiny computer chip.
test_ted_1160_35	/mnt/zhangyh/DATA/mustc-enes/test-split/test_ted_1160_35.wav	324	Y pueden tratar de ver el punto verde justo en el medio.	and you can sort of see this green dot right in the middle.
test_ted_1160_36	/mnt/zhangyh/DATA/mustc-enes/test-split/test_ted_1160_36.wav	243	Ese es el pedacito de metal del que voy a hablar en un minuto.	and that's this piece of metal i'm going to be talking about in a minute.
test_ted_1160_37	/mnt/zhangyh/DATA/mustc-enes/test-split/test_ted_1160_37.wav	190	Esta es una foto del objeto.	this is a photograph of the object.
test_ted_1160_38	/mnt/zhangyh/DATA/mustc-enes/test-split/test_ted_1160_38.wav	128	Y aquí lo voy a ampliar un poquito.	and here i'll zoom in a little bit.
test_ted_1160_39	/mnt/zhangyh/DATA/mustc-enes/test-split/test_ted_1160_39.wav	129	Se encuentra justo en el centro.	we're looking right there in the center.
test_ted_1160_40	/mnt/zhangyh/DATA/mustc-enes/test-split/test_ted_1160_40.wav	303	Y luego aquí hacemos un acercamiento bien bien grande al pequeño trocito de metal.	and then here's a really, really big close-up of the little piece of metal.
test_ted_1160_41	/mnt/zhangyh/DATA/mustc-enes/test-split/test_ted_1160_41.wav	476	Lo que vemos es un pequeño pedacito de metal, con forma de trampolín y que sobresale apoyado en una plataforma.	so what we're looking at is a little chunk of metal, and it's shaped like a diving board, and it's sticking out over a ledge.
