id	audio	n_frames	tgt_text	src_text
test_ted_1330_72	/mnt/zhangyh/DATA/mustc-enes/test-split/test_ted_1330_72.wav	445	Porque las imágenes hacían que se viera más real.	because the pictures made it feel more real to you.
test_ted_1330_73	/mnt/zhangyh/DATA/mustc-enes/test-split/test_ted_1330_73.wav	573	Esto me lleva a la segunda técnica para manejar el problema de la sobrecarga de opciones. que es Concretar.	which brings me to the second technique for handling the choice overload problem, which is concretization.
test_ted_1330_74	/mnt/zhangyh/DATA/mustc-enes/test-split/test_ted_1330_74.wav	2419	Para que la gente entienda las diferencias entre opciones, tienen que comprender las consecuencias de cada opción, y que las consecuencias deben sentirse de manera muy vívida, muy concreta. ¿Por qué razón la gente gasta 15% a 30% más en promedio cuando usa tarjetas de débito o crédito, que cuando usa efectivo?	that in order for people to understand the differences between the choices, they have to be able to understand the consequences associated with each choice, and that the consequences need to be felt in a vivid sort of way, in a very concrete way. why do people spend an average of 15 to 30 percent more when they use an atm card or a credit card as opposed to cash?
test_ted_1330_75	/mnt/zhangyh/DATA/mustc-enes/test-split/test_ted_1330_75.wav	181	Porque no parece dinero real.	because it doesn't feel like real money.
test_ted_1330_76	/mnt/zhangyh/DATA/mustc-enes/test-split/test_ted_1330_76.wav	813	Resulta que hacer que se vea más real, puede ser una herramienta muy positiva para que la gente ahorre más.	and it turns out that making it feel more concrete can actually be a very positive tool to use in getting people to save more.
test_ted_1330_77	/mnt/zhangyh/DATA/mustc-enes/test-split/test_ted_1330_77.wav	1591	Hicimos un estudio con Shlomo Benartzi y Alessandro Previtero, sobre personal de ING -funcionarios que trabajaban en ING. estas personas estaban en una reunión en la que se estaban afiliando a un plan 401 (k).	so a study that i did with shlomo benartzi and alessandro previtero, we did a study with people at ing — employees that are all working at ing — and now these people were all in a session where they're doing enrollment for their 401 (k) plan.
test_ted_1330_78	/mnt/zhangyh/DATA/mustc-enes/test-split/test_ted_1330_78.wav	608	A esa reunión, que conservamos exactamente como se acostumbraba, le hicimos una pequeña adición.	and during that session, we kept the session exactly the way it used to be, but we added one little thing.
test_ted_1330_79	/mnt/zhangyh/DATA/mustc-enes/test-split/test_ted_1330_79.wav	1033	Lo que añadimos fue que le solicitamos al personal que pensaran en las cosas positivas que sucederían en sus vidas si ahorraban más dinero.	the one little thing we added was we asked people to just think about all the positive things that would happen in your life if you saved more.
test_ted_1330_80	/mnt/zhangyh/DATA/mustc-enes/test-split/test_ted_1330_80.wav	1342	Con esta minucia hubo un aumento en las afiliaciones del 20% y un incremento en la cantidad que estaban interesados en ahorrar o en lo que querían colocar en sus cuentas de ahorros, de 4%.	by doing that simple thing, there was an increase in enrollment by 20 percent and there was an increase in the amount of people willing to save or the amount that they were willing to put down into their savings account by four percent.
test_ted_1330_81	/mnt/zhangyh/DATA/mustc-enes/test-split/test_ted_1330_81.wav	273	La tercera técnica es Clasificar.	the third technique: categorization.
test_ted_1330_82	/mnt/zhangyh/DATA/mustc-enes/test-split/test_ted_1330_82.wav	540	Podemos manejar más categorías que opciones.	we can handle more categories than we can handle choices.
test_ted_1330_83	/mnt/zhangyh/DATA/mustc-enes/test-split/test_ted_1330_83.wav	453	Por ejemplo, este es un estudio que hicimos en un pasillo de revistas.	so for example, here's a study we did in a magazine aisle.
test_ted_1330_84	/mnt/zhangyh/DATA/mustc-enes/test-split/test_ted_1330_84.wav	1026	Vimos que en los supermercados Wegman 's a lo largo del corredor del nordeste, la exhibición de revistas puede contener desde 331 tipos diferentes hasta 664.	it turns out that in wegmans grocery stores up and down the northeast corridor, the magazine aisles range anywhere from 331 different kinds of magazines all the way up to 664.
test_ted_1330_85	/mnt/zhangyh/DATA/mustc-enes/test-split/test_ted_1330_85.wav	241	Pero, ¿saben?	but you know what?
test_ted_1330_86	/mnt/zhangyh/DATA/mustc-enes/test-split/test_ted_1330_86.wav	1793	si les muestro 600 revistas y las divido en 10 categorías, y comparo con 400 divididas en 20 grupos, creerán que les he ofrecido más opciones y una mejor experiencia de elección si ofrezco esas 400, que si pongo 600.	if i show you 600 magazines and i divide them up into 10 categories, versus i show you 400 magazines and divide them up into 20 categories, you believe that i have given you more choice and a better choosing experience if i gave you the 400 than if i gave you the 600.
test_ted_1330_87	/mnt/zhangyh/DATA/mustc-enes/test-split/test_ted_1330_87.wav	343	Porque la clasificación me indica cómo diferenciarlas.	because the categories tell me how to tell them apart.
test_ted_1330_88	/mnt/zhangyh/DATA/mustc-enes/test-split/test_ted_1330_88.wav	451	Estas son dos exhibiciones de joyas.	here are two different jewelry displays.
test_ted_1330_89	/mnt/zhangyh/DATA/mustc-enes/test-split/test_ted_1330_89.wav	1430	Una se llama "Jazz" y la otra, "Swing". Si piensan que la de la izquierda es Swing y la de la derecha es Jazz, den una palmada. (Pocos aplausos) Bueno, hay algunos.	one is called "jazz" and the other one is called "swing." if you think the display on the left is swing and the display on the right is jazz, clap your hands. (light clapping) okay, there's some.
test_ted_1330_90	/mnt/zhangyh/DATA/mustc-enes/test-split/test_ted_1330_90.wav	470	Si piensan que la de la izquierda es Jazz y la de la derecha es Swing, den una palmada.	if you think the one on the left is jazz and the one on the right is swing, clap your hands.
test_ted_1330_91	/mnt/zhangyh/DATA/mustc-enes/test-split/test_ted_1330_91.wav	180	Bueno, algo más.	okay, a bit more.
test_ted_1330_92	/mnt/zhangyh/DATA/mustc-enes/test-split/test_ted_1330_92.wav	200	Resulta que es correcto.	now it turns out you're right.
test_ted_1330_93	/mnt/zhangyh/DATA/mustc-enes/test-split/test_ted_1330_93.wav	394	La de la izquierda es Jazz y la de la derecha es Swing. Pero, ¿saben algo?	the one on the left is jazz and the one on the right is swing, but you know what?
test_ted_1330_94	/mnt/zhangyh/DATA/mustc-enes/test-split/test_ted_1330_94.wav	1024	Este esquema de clasificación es totalmente inútil. (Risas) Las categorías deben indicar algo a quien escoge, no al que las define.	this is a highly useless categorization scheme. (laughter) the categories need to say something to the chooser, not the choice-maker.
test_ted_1330_95	/mnt/zhangyh/DATA/mustc-enes/test-split/test_ted_1330_95.wav	537	A menudo se ve este problema con esas enormes listas de fondos.	and you often see that problem when it comes down to those long lists of all these funds.
test_ted_1330_96	/mnt/zhangyh/DATA/mustc-enes/test-split/test_ted_1330_96.wav	254	Supuestamente ¿a quién están informando?	who are they actually supposed to be informing?
test_ted_1330_97	/mnt/zhangyh/DATA/mustc-enes/test-split/test_ted_1330_97.wav	350	Mi cuarta categoría: Condicionar la complejidad.	my fourth technique: condition for complexity.
test_ted_1330_98	/mnt/zhangyh/DATA/mustc-enes/test-split/test_ted_1330_98.wav	671	Resulta que podemos manejar mucha más información que lo que pensamos, si solo la simplificamos un poco.	it turns out we can actually handle a lot more information than we think we can, we've just got to take it a little easier.
test_ted_1330_99	/mnt/zhangyh/DATA/mustc-enes/test-split/test_ted_1330_99.wav	274	Tenemos que aumentar la complejidad gradualmente.	we have to gradually increase the complexity.
test_ted_1330_100	/mnt/zhangyh/DATA/mustc-enes/test-split/test_ted_1330_100.wav	336	Voy a mostrarles un ejemplo de lo que quiero decir.	i'm going to show you one example of what i'm talking about.
test_ted_1330_101	/mnt/zhangyh/DATA/mustc-enes/test-split/test_ted_1330_101.wav	355	Veamos una decisión bien complicada; la compra de un auto.	let's take a very, very complicated decision: buying a car.
test_ted_1330_102	/mnt/zhangyh/DATA/mustc-enes/test-split/test_ted_1330_102.wav	569	Este es un fabricante alemán de autos que permite personalizarlo por completo.	here's a german car manufacturer that gives you the opportunity to completely custom make your car.
test_ted_1330_103	/mnt/zhangyh/DATA/mustc-enes/test-split/test_ted_1330_103.wav	390	Tienes que tomar 60 decisiones, para armar el coche.	you've got to make 60 different decisions, completely make up your car.
test_ted_1330_104	/mnt/zhangyh/DATA/mustc-enes/test-split/test_ted_1330_104.wav	401	Y estas decisiones varían en el número de opciones que ofrece cada una.	now these decisions vary in the number of choices that they offer per decision.
test_ted_1330_105	/mnt/zhangyh/DATA/mustc-enes/test-split/test_ted_1330_105.wav	603	Colores, color exterior del auto. Tengo 56 posibilidades. Motor, caja de cambios; 4 opciones.	car colors, exterior car colors — i've got 56 choices. engines, gearshift — four choices.
test_ted_1330_106	/mnt/zhangyh/DATA/mustc-enes/test-split/test_ted_1330_106.wav	622	Lo que voy a hacer es variar el orden en que aparecen las decisiones.	so now what i'm going to do is i'm going to vary the order in which these decisions appear.
test_ted_1330_107	/mnt/zhangyh/DATA/mustc-enes/test-split/test_ted_1330_107.wav	620	De modo que la mitad de los clientes van a ir de muchas opciones, 56 colores, a unas pocas, cuatro cajas.	so half of the customers are going to go from high choice, 56 car colors, to low choice, four gearshifts.
test_ted_1330_108	/mnt/zhangyh/DATA/mustc-enes/test-split/test_ted_1330_108.wav	732	La otra mitad de los clientes van a ir de pocas opciones, cuatro cajas, a 56 colores, muchas opciones.	the other half of the customers are going to go from low choice, four gearshifts, to 56 car colors, high choice.
test_ted_1330_109	/mnt/zhangyh/DATA/mustc-enes/test-split/test_ted_1330_109.wav	283	Y ¿qué voy a mirar?	what am i going to look at?
test_ted_1330_110	/mnt/zhangyh/DATA/mustc-enes/test-split/test_ted_1330_110.wav	161	Qué tan involucrado estás.	how engaged you are.
test_ted_1330_111	/mnt/zhangyh/DATA/mustc-enes/test-split/test_ted_1330_111.wav	652	Si se acciona siempre el botón por defecto en cada decisión, esto indica que están abrumados, o sea: los estamos perdiendo.	if you keep hitting the default button per decision, that means you're getting overwhelmed, that means i'm losing you.
test_ted_1330_112	/mnt/zhangyh/DATA/mustc-enes/test-split/test_ted_1330_112.wav	866	Encontramos que los que van de muchas opciones a pocas, oprimen el botón por defecto una y otra vez, y otra más. Los perdemos. Si van de pocas opciones a muchas, continúan ahí.	what you find is the people who go from high choice to low choice, they're hitting that default button over and over and over again. we're losing them.
test_ted_1330_113	/mnt/zhangyh/DATA/mustc-enes/test-split/test_ted_1330_113.wav	831	La misma información, el mismo número de opciones.	it's the same information. it's the same number of choices.
test_ted_1330_114	/mnt/zhangyh/DATA/mustc-enes/test-split/test_ted_1330_114.wav	491	Lo único que hice fue alterar el orden en que se presenta la información.	the only thing that i have done is i have varied the order in which that information is presented.
test_ted_1330_115	/mnt/zhangyh/DATA/mustc-enes/test-split/test_ted_1330_115.wav	428	Si comenzamos con lo fácil, uno aprende a escoger.	if i start you off easy, i learn how to choose.
test_ted_1330_116	/mnt/zhangyh/DATA/mustc-enes/test-split/test_ted_1330_116.wav	956	Aunque el escoger la caja de cambios no diga nada sobre las preferencias de la decoración interior, de todas maneras nos prepara para elegir.	even though choosing gearshift doesn't tell me anything about my preferences for interior decor, it still prepares me for how to choose.
test_ted_1330_117	/mnt/zhangyh/DATA/mustc-enes/test-split/test_ted_1330_117.wav	600	Nos entusiasma un producto que estamos construyendo que ahora nos tiene más enganchados con el proceso.	it also gets me excited about this big product that i'm putting together, so i'm more willing to be motivated to be engaged.
test_ted_1330_118	/mnt/zhangyh/DATA/mustc-enes/test-split/test_ted_1330_118.wav	1885	Para resumir. He hablado de cuatro técnicas para mitigar el problema de la sobrecarga de opciones: Cortar, eliminar alternativas extrañas; Concretar, hacerlo real; Clasificar, podemos manejar más categorías con menos opciones; Condicionar la complejidad.	so let me recap. i have talked about four techniques for mitigating the problem of choice overload — cut — get rid of the extraneous alternatives; concretize — make it real; categorize — we can handle more categories, less choices; condition for complexity.
test_ted_1330_119	/mnt/zhangyh/DATA/mustc-enes/test-split/test_ted_1330_119.wav	1310	Todas estas técnicas que les he presentado fueron diseñadas para ayudar a manejar las alternativas; o mejor, para ustedes, para usarlas en sus asuntos, o para las personas a quienes sirven.	all of these techniques that i'm describing to you today are designed to help you manage your choices — better for you, you can use them on yourself, better for the people that you are serving.
test_ted_1330_120	/mnt/zhangyh/DATA/mustc-enes/test-split/test_ted_1330_120.wav	567	Es que pienso que la clave para obtener lo mejor de una elección es siendo cuidadoso al escoger.	because i believe that the key to getting the most from choice is to be choosy about choosing.
test_ted_1330_121	/mnt/zhangyh/DATA/mustc-enes/test-split/test_ted_1330_121.wav	760	Y cuanto más cuidadosos seamos en nuestras elecciones mejor podremos practicar el arte de elegir.	and the more we're able to be choosy about choosing the better we will be able to practice the art of choosing.
test_ted_1330_122	/mnt/zhangyh/DATA/mustc-enes/test-split/test_ted_1330_122.wav	160	Muchas gracias.	thank you very much.
test_ted_1337_0	/mnt/zhangyh/DATA/mustc-enes/test-split/test_ted_1337_0.wav	486	Creo que tenemos que hacer algo con una parte de la cultura médica que debe cambiar.	i think we have to do something about a piece of the culture of medicine that has to change.
test_ted_1337_1	/mnt/zhangyh/DATA/mustc-enes/test-split/test_ted_1337_1.wav	238	Y creo que esto empieza con un médico, y ese soy yo.	and i think it starts with one physician, and that's me.
test_ted_1337_2	/mnt/zhangyh/DATA/mustc-enes/test-split/test_ted_1337_2.wav	536	Y he ejercido el tiempo suficiente para permitirme ceder parte de mi falso prestigio en eso.	and maybe i've been around long enough that i can afford to give away some of my false prestige to be able to do that.
test_ted_1337_3	/mnt/zhangyh/DATA/mustc-enes/test-split/test_ted_1337_3.wav	516	Antes de tratar el tema de mi charla, hablemos un poco de béisbol. ¿Por qué no?	before i actually begin the meat of my talk, let's begin with a bit of baseball. hey, why not?
test_ted_1337_4	/mnt/zhangyh/DATA/mustc-enes/test-split/test_ted_1337_4.wav	277	Estamos cerca de la final, se aproxima la Serie Mundial.	we're near the end, we're getting close to the world series.
test_ted_1337_5	/mnt/zhangyh/DATA/mustc-enes/test-split/test_ted_1337_5.wav	752	Nos encanta el béisbol, ¿cierto? (Risas) El béisbol está lleno de estadísticas sorprendentes.	we all love baseball, don't we? (laughter) baseball is filled with some amazing statistics.
test_ted_1337_6	/mnt/zhangyh/DATA/mustc-enes/test-split/test_ted_1337_6.wav	847	Hay cientos de estadísticas. Está por salir "Rompiendo las reglas"; habla de las estadísticas y de usarlas para formar un gran equipo de béisbol.	and there's hundreds of them. "moneyball" is about to come out, and it's all about statistics and using statistics to build a great baseball team.
test_ted_1337_7	/mnt/zhangyh/DATA/mustc-enes/test-split/test_ted_1337_7.wav	420	Me centraré en una de ellas y espero que muchos de Uds. la conozcan.	i'm going to focus on one stat that i hope a lot of you have heard of.
test_ted_1337_8	/mnt/zhangyh/DATA/mustc-enes/test-split/test_ted_1337_8.wav	122	Se llama promedio de bateo.	it's called batting average.
test_ted_1337_9	/mnt/zhangyh/DATA/mustc-enes/test-split/test_ted_1337_9.wav	349	Y hablamos de 300, de un bateador que batea 300.	so we talk about a 300, a batter who bats 300.
test_ted_1337_10	/mnt/zhangyh/DATA/mustc-enes/test-split/test_ted_1337_10.wav	639	Eso significa que el beisbolista bateó eficazmente, 3 de 10 veces.	that means that ballplayer batted safely, hit safely three times out of 10 at bats.
test_ted_1337_11	/mnt/zhangyh/DATA/mustc-enes/test-split/test_ted_1337_11.wav	774	Eso significa lanzar la pelota al campo de juego sin ser atrapada, y que cualquiera que trate de lanzarla a la primera base, no llegue a tiempo, y la segunda base estará salvada.	that means hit the ball into the outfield, it dropped, it didn't get caught, and whoever tried to throw it to first base didn't get there in time and the runner was safe.
test_ted_1337_12	/mnt/zhangyh/DATA/mustc-enes/test-split/test_ted_1337_12.wav	803	3 intentos de 10. ¿Uds. saben cómo llaman a un bateador de 300 en las Grandes Ligas?	three times out of 10. do you know what they call a 300 hitter in major league baseball?
test_ted_1337_13	/mnt/zhangyh/DATA/mustc-enes/test-split/test_ted_1337_13.wav	917	Bueno, realmente bueno, tal vez del equipo de las estrellas. ¿Uds. saben cómo llaman a un bateador de béisbol de 400?	good, really good, maybe an all-star. do you know what they call a 400 baseball hitter?
test_ted_1337_14	/mnt/zhangyh/DATA/mustc-enes/test-split/test_ted_1337_14.wav	353	Por cierto, ese es alguien que de 10 golpes, acierta 4.	that's somebody who hit, by the way, four times safely out of every 10.
test_ted_1337_15	/mnt/zhangyh/DATA/mustc-enes/test-split/test_ted_1337_15.wav	817	Legendario... como el legendario Ted Williams, el último jugador de la Liga Mayor de Béisbol en ejecutar más 400 golpes en una temporada regular.	legendary — as in ted williams legendary — the last major league baseball player to hit over 400 during a regular season.
test_ted_1337_16	/mnt/zhangyh/DATA/mustc-enes/test-split/test_ted_1337_16.wav	725	Ahora traslademos esto a mi mundo de la medicina donde me siento mucho más cómodo, o tal vez menos incómodo, después de lo que les contaré hoy.	now let's take this back into my world of medicine where i'm a lot more comfortable, or perhaps a bit less comfortable after what i'm going to talk to you about.
test_ted_1337_17	/mnt/zhangyh/DATA/mustc-enes/test-split/test_ted_1337_17.wav	1157	Supongan que tienen apendicitis y son derivados a un cirujano que tiene también un récord de 400 en apendicetomías. (Risas) Así no funciona, ¿cierto?	suppose you have appendicitis and you're referred to a surgeon who's batting 400 on appendectomies. (laughter) somehow this isn't working out, is it?
test_ted_1337_18	/mnt/zhangyh/DATA/mustc-enes/test-split/test_ted_1337_18.wav	1626	Ahora supongan que viven en un lugar alejado y un ser querido tiene dos arterias coronarias obstruidas y su médico de familia lo deriva a un cardiólogo cuyo récord en angioplastia es de 200.	now suppose you live in a certain part of a certain remote place and you have a loved one who has blockages in two coronary arteries and your family doctor refers that loved one to a cardiologist who's batting 200 on angioplasties.
test_ted_1337_19	/mnt/zhangyh/DATA/mustc-enes/test-split/test_ted_1337_19.wav	128	Pero, ¿saben algo?	but, but, you know what?
test_ted_1337_20	/mnt/zhangyh/DATA/mustc-enes/test-split/test_ted_1337_20.wav	623	Ella está mejorando notablemente este año y sus aciertos han sido 257.	she's doing a lot better this year. she's on the comeback trail. and she's hitting a 257.
test_ted_1337_21	/mnt/zhangyh/DATA/mustc-enes/test-split/test_ted_1337_21.wav	134	Esto no está funcionando.	somehow this isn't working.
test_ted_1337_22	/mnt/zhangyh/DATA/mustc-enes/test-split/test_ted_1337_22.wav	894	Pero les preguntaré: ¿Cuál creen Uds. que debe ser el promedio de aciertos de un cirujano cardíaco u ortopédico, de una enfermera o de un obstetra ginecólogo?	but i'm going to ask you a question. what do you think a batting average for a cardiac surgeon or a nurse practitioner or an orthopedic surgeon, an obgyn, a paramedic is supposed to be?
test_ted_1337_23	/mnt/zhangyh/DATA/mustc-enes/test-split/test_ted_1337_23.wav	580	1000, muy bien.	1,000, very good.
test_ted_1337_24	/mnt/zhangyh/DATA/mustc-enes/test-split/test_ted_1337_24.wav	981	Y la verdad del asunto es que nadie en toda la medicina conoce los aciertos de un buen cirujano, de un médico o paramédico.	now truth of the matter is, nobody knows in all of medicine what a good surgeon or physician or paramedic is supposed to bat.
test_ted_1337_25	/mnt/zhangyh/DATA/mustc-enes/test-split/test_ted_1337_25.wav	556	Lo que hacemos, sin embargo, es enviarlos al mundo, y me incluyo, con el mandato de ser perfectos.	what we do though is we send each one of them, including myself, out into the world with the admonition, be perfect.
test_ted_1337_26	/mnt/zhangyh/DATA/mustc-enes/test-split/test_ted_1337_26.wav	500	Que nunca, jamás, cometan un error y preocúpense de averiguar cómo hacerlo bien.	never ever, ever make a mistake, but you worry about the details, about how that's going to happen.
test_ted_1337_27	/mnt/zhangyh/DATA/mustc-enes/test-split/test_ted_1337_27.wav	315	Ese fue el mensaje que absorbí cuando estaba en la facultad de medicina.	and that was the message that i absorbed when i was in med school.
test_ted_1337_28	/mnt/zhangyh/DATA/mustc-enes/test-split/test_ted_1337_28.wav	263	Yo era un estudiante obsesivo compulsivo.	i was an obsessive compulsive student.
test_ted_1337_29	/mnt/zhangyh/DATA/mustc-enes/test-split/test_ted_1337_29.wav	870	Una vez, un compañero en la secundaria dijo que Brian Goldman estudiaba hasta para un examen de sangre. (Risas) Tal cual.	in high school, a classmate once said that brian goldman would study for a blood test. (laughter) and so i did.
test_ted_1337_30	/mnt/zhangyh/DATA/mustc-enes/test-split/test_ted_1337_30.wav	512	Estudiaba en mi pequeño desván, en la residencia de enfermeras del Hospital General de Toronto, no lejos de aquí.	and i studied in my little garret at the nurses' residence at toronto general hospital, not far from here.
test_ted_1337_31	/mnt/zhangyh/DATA/mustc-enes/test-split/test_ted_1337_31.wav	208	Y aprendí todo de memoria.	and i memorized everything.
test_ted_1337_32	/mnt/zhangyh/DATA/mustc-enes/test-split/test_ted_1337_32.wav	1011	De mi clase de anatomía, memoricé el origen y el trabajo muscular, la ramificación de cada arteria que sale de la aorta, el diagnóstico diferencial frecuente y el no habitual.	i memorized in my anatomy class the origins and exertions of every muscle, every branch of every artery that came off the aorta, differential diagnoses obscure and common.
test_ted_1337_33	/mnt/zhangyh/DATA/mustc-enes/test-split/test_ted_1337_33.wav	420	E incluso conocía el diagnóstico diferencial sobre cómo clasificar la acidosis tubular renal.	i even knew the differential diagnosis in how to classify renal tubular acidosis.
test_ted_1337_34	/mnt/zhangyh/DATA/mustc-enes/test-split/test_ted_1337_34.wav	278	Y mientras tanto acumulaba más y más conocimiento.	and all the while, i was amassing more and more knowledge.
test_ted_1337_35	/mnt/zhangyh/DATA/mustc-enes/test-split/test_ted_1337_35.wav	290	Y me iba muy bien; me gradué con honores.	and i did well, i graduated with honors, cum laude.
test_ted_1337_36	/mnt/zhangyh/DATA/mustc-enes/test-split/test_ted_1337_36.wav	1317	Y egresé de la escuela de medicina con la impresión de que si memorizaba todo, entonces sabría todo, o lo más posible, cercano al todo, porque así me inmunizaría de los errores.	and i came out of medical school with the impression that if i memorized everything and knew everything, or as much as possible, as close to everything as possible, that it would immunize me against making mistakes.
test_ted_1337_37	/mnt/zhangyh/DATA/mustc-enes/test-split/test_ted_1337_37.wav	554	Y funcionó por un tiempo, hasta que conocí a la señora Drucker.	and it worked for a while, until i met mrs. drucker.
test_ted_1337_38	/mnt/zhangyh/DATA/mustc-enes/test-split/test_ted_1337_38.wav	666	Yo era residente en un hospital universitario aquí, en Toronto cuando trajeron a la señora Drucker al servicio de emergencias donde yo trabajaba.	i was a resident at a teaching hospital here in toronto when mrs. drucker was brought to the emergency department of the hospital where i was working.
test_ted_1337_39	/mnt/zhangyh/DATA/mustc-enes/test-split/test_ted_1337_39.wav	392	En aquel momento me asignaron al servicio de cardiología.	at the time i was assigned to the cardiology service on a cardiology rotation.
test_ted_1337_40	/mnt/zhangyh/DATA/mustc-enes/test-split/test_ted_1337_40.wav	760	Y cuando emergencias solicitó consultar a un cardiólogo me tocó asistir a esa paciente e informar al jefe de residentes.	and it was my job, when the emergency staff called for a cardiology consult, to see that patient in emerg. and to report back to my attending.
test_ted_1337_41	/mnt/zhangyh/DATA/mustc-enes/test-split/test_ted_1337_41.wav	263	Cuando vi a la señora Drucker, estaba jadeando.	and i saw mrs. drucker, and she was breathless.
